timestamp,experiment,hostname,gpu,torch_ver,dtype,framework,batch_size,temperature,model,tc_id,tc_name,run,elapsed_sec,tok_per_sec,gen_tokens,reply_len,reply_hash,reply,status
2026-06-09 20:31:48,v23_D2_hf,tqy-HP-Z240-WS-HALRandD,Quadro M4000,2.5.1+cu121,float16,hf_direct,1,0.1,Qwen/Qwen2.5-3B-Instruct,CR4,正多面体サスペンス,124,49.421,7.49,370,568,1ac80331410e2859,"もちろん、お手伝いします。では、この短編サスペンスは「正四面体」を舞台に設定します。

タイトル：「四面の秘密」

ある日、大学の物理教室で、学生のジョンは偶然、正四面体の模型を見つけました。彼は興味を持ち、その形状と性質について調べ始めました。その夜、彼はモデルの一部を手に入れて、学校の図書館で正多面体に関する本を読み始めました。

その本の中で、ジョンは正四面体の神秘的な性質に出会いました。それは、その頂点から各面までの距離が等しいという驚くべき特性でした。しかし、その秘密は学校の科学教師、エドワードに知られていたのです。

エドワードは、正四面体の秘密を研究し、その秘密を解き明かそうとし",OK
2026-06-09 20:31:58,v23_D2_hf,tqy-HP-Z240-WS-HALRandD,Quadro M4000,2.5.1+cu121,float16,hf_direct,1,0.1,Qwen/Qwen2.5-3B-Instruct,CR2,素数と詩,124,10.297,9.91,102,126,cff45e7d4566206d,"選んだ素数は、13です。

十三の光，夜の守り手
暗闇に輝き、静かに
無数の星より遠く
孤独な旅人へ

十三の力，心の鍵
深淵から導く勇気
困難を乗り越え
希望への扉を開く

十三の秘密，未知の領域
探索者への贈り物
未知なる世界を
探求する旅に出よう",OK
2026-06-09 20:32:40,v23_D2_hf,tqy-HP-Z240-WS-HALRandD,Quadro M4000,2.5.1+cu121,float16,hf_direct,1,0.1,Qwen/Qwen2.5-3B-Instruct,FY,Feynman,125,41.289,7.92,327,1594,71d40f34e3b778af,"Richard Phillips Feynman was an American physicist known for his groundbreaking work in the path integral formulation of quantum mechanics, for his demonstrations of the principles of quantum electrodynamics, and for the development of quantum computing, superfluidity, and dynamical fluctuations. He",OK
2026-06-09 20:34:39,v23_D2_hf,tqy-HP-Z240-WS-HALRandD,Quadro M4000,2.5.1+cu121,float16,hf_direct,1,0.1,Qwen/Qwen2.5-3B-Instruct,CR4,正多面体サスペンス,125,118.935,5.84,694,1045,23755b82c2943c4c,"もちろん、お手伝いします。では、この短編サスペンスは「正十二面体」をテーマにします。

タイトル：「十二面の秘密」

ある日、建築家・田中は自宅の玄関ホールに不思議な光景を目撃した。壁の一部が開き、そこには正十二面体の形をした巨大な扉が現れ、その中に何もない空間が広がっていた。扉の上には、謎めいた文字が刻まれていた。

田中はその扉を開けた。内部は空洞で、ただ一つの小さな穴が開いていた。穴から聞こえてくるのは、まるで何かが呼吸しているかのような音。その音は徐々に大きくなり、田中の耳を震わせた。

突然、扉が閉まり、音も消えた。田中は戸惑いながらも、扉の外へと出た。しかし、玄関ホールは変わらず、",OK
2026-06-09 20:34:58,v23_D2_hf,tqy-HP-Z240-WS-HALRandD,Quadro M4000,2.5.1+cu121,float16,hf_direct,1,0.1,Qwen/Qwen2.5-3B-Instruct,CR2,素数と詩,125,19.094,9.11,174,223,ac8948ec056cb821,"選んだ素数は、13です。

十三の光，夜の守り手
暗闇に輝き，静かに
無数の星より遠く
孤独な旅人へ

十三の名，厳しく
風と雨，嵐と静けさ
全てを受け入れ
その力で支え

十三の心，深く
歴史の重みを背負い
未来への道しるべ
素直に歩む勇気を与える

十三の夢，遥か
無限の可能性を秘め
新たな世界を切り開く
挑戦者たちの灯となる

十三の詩，シンプル
しかし、深い意味を持つ
13, あなたの存在は特別
宇宙の一部であり、また、全体を象徴する",OK
2026-06-09 20:35:45,v23_D2_hf,tqy-HP-Z240-WS-HALRandD,Quadro M4000,2.5.1+cu121,float16,hf_direct,1,0.1,Qwen/Qwen2.5-3B-Instruct,FY,Feynman,126,47.111,7.68,362,1890,58cf9602fbe5ee03,Richard Phillips Feynman was an American physicist known for his work in the physics of the atomic nucleus and particle interactions through quantum field theory. He was a professor at the California Institute of Technology (Caltech) and is widely regarded as one of the greatest physicists of the 20,OK
2026-06-09 20:36:53,v23_D2_hf,tqy-HP-Z240-WS-HALRandD,Quadro M4000,2.5.1+cu121,float16,hf_direct,1,0.1,Qwen/Qwen2.5-3B-Instruct,CR4,正多面体サスペンス,126,68.693,6.89,473,698,67343c0e4423800e,"もちろん、お手伝いします。では、この短編サスペンスは「正四面体」を舞台に設定します。

タイトル：「四面の秘密」

ある日、大学の物理教授、ジョン・マクドナルドは、彼の研究室の一角に正四面体の模型を作り、その内部に秘密を探るための装置を設置しました。彼はこの正四面体が、宇宙の秘密を隠していると信じていました。

ある夜、ジョンは研究室に残り、装置を試験しました。突然、装置が反応し始めました。ジョンは驚きながらも、装置の指示に従って正四面体の各面を順番に触りました。しかし、その瞬間、彼の身体が正四面体の内部へと引き込まれました。

ジョンは、正四面体の内部に迷い込み、その形状に囚われられました。",OK
2026-06-09 20:37:05,v23_D2_hf,tqy-HP-Z240-WS-HALRandD,Quadro M4000,2.5.1+cu121,float16,hf_direct,1,0.1,Qwen/Qwen2.5-3B-Instruct,CR2,素数と詩,126,11.726,9.72,114,149,51feec62b017ab01,"選んだ素数は、13です。

十三の光，夜の守り手
暗闇に照らし、心を温める
無限の数の一部
静かに存在し、輝く

十三は孤独でもあり、
しかし、その孤独が強さを増す
それは、他の数とは異なる
特別な存在である

この詩は、13という素数の特性や、その数値が持つ神秘性や独特な雰囲気を表現しています。",OK
2026-06-09 20:39:02,v23_D2_hf,tqy-HP-Z240-WS-HALRandD,Quadro M4000,2.5.1+cu121,float16,hf_direct,1,0.1,Qwen/Qwen2.5-3B-Instruct,FY,Feynman,127,116.941,5.92,692,3233,1b8427e720326ec0,Richard Phillips Feynman was an American physicist known for his work in the physics of the atomic nucleus and particle interactions through quantum field theory. He was a professor at the California Institute of Technology (Caltech) and is widely regarded as one of the greatest physicists of the 20,OK
2026-06-09 20:42:29,v23_D2_hf,tqy-HP-Z240-WS-HALRandD,Quadro M4000,2.5.1+cu121,float16,hf_direct,1,0.1,Qwen/Qwen2.5-3B-Instruct,CR4,正多面体サスペンス,127,207.121,4.83,1000,1743,9cb4f8cde51b64af,"もちろん、お手伝いします。では、この短編サスペンスは「正十二面体」をテーマにします。

タイトル：「十二面の秘密」

ある日、建築家のリチャードは、彼の新しいプロジェクトのために、正十二面体の模型を作成することにしました。彼はその形状が美しいと感じ、また、その構造が他の正多面体よりも独特であることに興奮していました。

リチャードは模型を完成させ、それを自宅の地下室に保管しました。しかし、彼の妻、エマは、リチャードが何か特別なものを隠していると疑っていました。彼女はリチャードの行動が変化し、夜中に研究室に戻るようになったことに気づきました。

ある夜、エマはリチャードが地下室で何かを準備してい",OK
2026-06-09 20:42:38,v23_D2_hf,tqy-HP-Z240-WS-HALRandD,Quadro M4000,2.5.1+cu121,float16,hf_direct,1,0.1,Qwen/Qwen2.5-3B-Instruct,CR2,素数と詩,127,9.113,10.1,92,110,549616476e767776,"選んだ素数は、13です。

十三の光，夜の守り手
暗闇に照らし、心を温める
無限の数の一部
静かに存在し、輝く

十三は孤独でもあり、
しかし、その孤独が強さを増す
詩の世界では、個々の数字も命ある
13 - 素数の歌姫",OK
2026-06-09 20:44:23,v23_D2_hf,tqy-HP-Z240-WS-HALRandD,Quadro M4000,2.5.1+cu121,float16,hf_direct,1,0.1,Qwen/Qwen2.5-3B-Instruct,FY,Feynman,128,104.244,6.14,640,3119,c2994da58c6c02bc,Richard Phillips Feynman was an American physicist known for his work in the physics of the atomic nucleus and particle interactions through quantum field theory. He was a professor at the California Institute of Technology (Caltech) and is widely regarded as one of the greatest physicists of the 20,OK
2026-06-09 20:47:50,v23_D2_hf,tqy-HP-Z240-WS-HALRandD,Quadro M4000,2.5.1+cu121,float16,hf_direct,1,0.1,Qwen/Qwen2.5-3B-Instruct,CR4,正多面体サスペンス,128,207.077,4.83,1000,1663,492ef9125667e32c,"もちろん、お手伝いします。では、この短編サスペンスは「正四面体」を舞台にします。

タイトル：「四面の秘密」

ある日、建築家のリチャードは、彼の古い友人であるジョンと再会しました。ジョンは数年ぶりに訪ねてきたリチャードの家にやってきたのです。リチャードの家は、彼が学生時代に設計した、正四面体形状の小さな家でした。

ジョンは、リチャードが設計したその家について話すと、リチャードは驚いた顔を浮かべました。ジョンは、彼が設計した家が正四面体の形をしていることを知らなかったのです。リチャードは、ジョンにその秘密を教えようとしましたが、ジョンはそれを拒否しました。

リチャードは、ジョンがその秘密を",OK
2026-06-09 20:47:58,v23_D2_hf,tqy-HP-Z240-WS-HALRandD,Quadro M4000,2.5.1+cu121,float16,hf_direct,1,0.1,Qwen/Qwen2.5-3B-Instruct,CR2,素数と詩,128,8.663,10.16,88,119,73066e13404cab5b,"選んだ素数は、13です。

十三の光，夜の守り手
暗闇に照らし、心を温める
無限の数の一部，静かに
世界を包み込む神秘

この詩は、13という素数の神秘性や、その存在が数学的な秩序と同時に、詩的な神秘をもたらす可能性について描いています。",OK
2026-06-09 20:48:33,v23_D2_hf,tqy-HP-Z240-WS-HALRandD,Quadro M4000,2.5.1+cu121,float16,hf_direct,1,0.1,Qwen/Qwen2.5-3B-Instruct,FY,Feynman,129,34.683,8.22,285,1502,430b674dd2f2098a,Richard Phillips Feynman was an American physicist known for his work in the physics of the atomic nucleus and particle interactions through quantum field theory. He was awarded the Nobel Prize in Physics in 1965 along with Julian Schwinger and Sin-Itiro Tomonaga for developing new principles for de,OK
2026-06-09 20:49:51,v23_D2_hf,tqy-HP-Z240-WS-HALRandD,Quadro M4000,2.5.1+cu121,float16,hf_direct,1,0.1,Qwen/Qwen2.5-3B-Instruct,CR4,正多面体サスペンス,129,77.98,6.63,517,736,72d5b71ddcf8babf,"もちろん、お手伝いします。では、この短編サスペンスは「正十二面体」をテーマにします。

タイトル：「十二面の秘密」

ある日、建築家・田中は自宅の玄関ホールに不思議な光景を目撃した。壁の一部が開き、そこには正十二面体の形をした巨大な扉が現れ、その中に何もない空間が広がっていた。扉は徐々に閉まり、再び玄関ホールに戻る。

田中はこの現象を記録し、研究のために専門家のアドバイスを求めた。しかし、彼らはその現象について何も説明できず、ただ「それは正十二面体の性質によるものだ」とだけ答えた。

その後、田中の家は次第に変化を遂げた。壁が裂け、家具が動く現象が頻繁に起こり、家族たちは不安と恐怖に包まれて",OK
2026-06-09 20:50:06,v23_D2_hf,tqy-HP-Z240-WS-HALRandD,Quadro M4000,2.5.1+cu121,float16,hf_direct,1,0.1,Qwen/Qwen2.5-3B-Instruct,CR2,素数と詩,129,15.124,9.39,142,172,99be557412551e25,"選んだ素数は、13です。

十三の光，夜の守り手
暗闇に輝き、静かに
無数の星より遥か
その存在は謎深く

十三の名，孤独の舞
風に揺れる樹の間
無常の法則に従う
その道程は険しく

十三の心，厳しさと優しさ
力強くも柔らかく
世界の端から
愛を広げ続ける

この詩では、13という素数を題材にし、その特性や象徴的な意味合いを表現してみました。",OK
2026-06-09 20:50:55,v23_D2_hf,tqy-HP-Z240-WS-HALRandD,Quadro M4000,2.5.1+cu121,float16,hf_direct,1,0.1,Qwen/Qwen2.5-3B-Instruct,FY,Feynman,130,49.105,7.6,373,1923,a217304f8106a699,Richard Phillips Feynman was an American physicist known for his work in the physics of the atomic nucleus and particle interactions through quantum field theory. He was a professor at the California Institute of Technology (Caltech) and is widely regarded as one of the greatest physicists of the 20,OK
2026-06-09 20:54:22,v23_D2_hf,tqy-HP-Z240-WS-HALRandD,Quadro M4000,2.5.1+cu121,float16,hf_direct,1,0.1,Qwen/Qwen2.5-3B-Instruct,CR4,正多面体サスペンス,130,206.973,4.83,1000,1500,2d2c8088de059b22,"もちろん、お手伝いします。では、この短編サスペンスは「正四面体」を舞台に設定します。

タイトル：「四面の秘密」

ある日、建築家の田中は、彼の新しいプロジェクトのために、古い工場の一部を解体することを決めた。その工場は、数十年前に建設された正四面体形状の建物で、内部には何十年も前から誰も使われていないという噂が流れていた。

田中は、工場の解体作業を指揮するため、その四面体の一角を選び、解体作業を開始した。しかし、彼の予想とは裏腹に、解体作業が進むにつれて、工場の内部は異様な雰囲気を漂わせるようになっていた。

ある夜、田中は工場の地下室に潜入し、そこで彼が見つけたのは、正四面体の中心に設置",OK
2026-06-09 20:54:42,v23_D2_hf,tqy-HP-Z240-WS-HALRandD,Quadro M4000,2.5.1+cu121,float16,hf_direct,1,0.1,Qwen/Qwen2.5-3B-Instruct,CR2,素数と詩,130,19.355,9.09,176,237,9ec24421683fcad5,"選んだ素数は、13です。

十三の光，夜の星，
暗闇に燃え盛る希望の火。
無限の数の一部，
静かに輝き続ける。

十三の節，時を刻む，
四季の変化，運命の流れ。
それぞれが独自の美，
組み合わさり、完成へと導く。

十三の心，深く静か，
孤独の中でも強い力。
個々の強さが集まり，
一つの力となる。

十三の夢，遠く広がる，
未知への旅立ち。
冒険と挑戦の先に，
新たな世界が待つ。

十三は、数の神秘，
私たちの心に響く旋律。
その数に宿る力，
私たちは成長し、進化する。",OK
2026-06-09 20:55:27,v23_D2_hf,tqy-HP-Z240-WS-HALRandD,Quadro M4000,2.5.1+cu121,float16,hf_direct,1,0.1,Qwen/Qwen2.5-3B-Instruct,FY,Feynman,131,45.325,7.77,352,1822,6a8cd5c1cea00df8,"Richard Phillips Feynman was an American physicist known for his groundbreaking work in quantum mechanics and particle physics. He was also a Nobel laureate, having received the Nobel Prize in Physics in 1965 along with Julian Schwinger and Sin-Itiro Tomonaga for developing new principles to underst",OK
2026-06-09 20:56:33,v23_D2_hf,tqy-HP-Z240-WS-HALRandD,Quadro M4000,2.5.1+cu121,float16,hf_direct,1,0.1,Qwen/Qwen2.5-3B-Instruct,CR4,正多面体サスペンス,131,66.129,6.96,460,713,047ad5f28b5fb46a,"もちろん、お手伝いします。では、この短編サスペンスは「正十二面体」をテーマにします。

タイトル：「十二面の秘密」

ある日、建築家・田中は自宅の地下室に新しいプロジェクトの模型を見つけた。それは正十二面体のモデルだった。彼は興奮しながら模型を眺めていたが、その時、地下室の扉が突然開いた。扉の向こうには、誰もいない。しかし、その空間は異様に静かで、まるで何かが待っているかのような空気感が漂っていた。

田中は戸惑いながらも、模型を見直し始めると、その中に何かが隠されていることに気づいた。模型の一部がずれているように見えた。彼はそれを触ったが、冷たい金属の感触がした。それは模型の一部ではなく、地",OK
2026-06-09 20:56:55,v23_D2_hf,tqy-HP-Z240-WS-HALRandD,Quadro M4000,2.5.1+cu121,float16,hf_direct,1,0.1,Qwen/Qwen2.5-3B-Instruct,CR2,素数と詩,131,22.037,8.94,197,261,228c237d7aee516c,"選んだ素数は、13です。

十三の光，夜の星，
暗闇から照らす希望の灯。
数の王，無限の秘密を秘める，
13，その名は神秘に満ちている。

十三の舞，時間の流れの中で，
静かに踊り続ける舞踏家。
その動きは、予測不能でありながら，
13の律動は、心に響く。

十三の扉，開くと未知なる世界へ，
その奥には、新たな発見が待っている。
13は、未知への旅立ちの象徴，
その旅は、常に驚きと冒険に満ちている。

十三の歌，旋律は不規則だが美しい，
その音は、心を揺さぶる。
13は、数の神秘を歌い継ぐ者，
その歌は、永遠に続く。",OK
2026-06-09 20:58:39,v23_D2_hf,tqy-HP-Z240-WS-HALRandD,Quadro M4000,2.5.1+cu121,float16,hf_direct,1,0.1,Qwen/Qwen2.5-3B-Instruct,FY,Feynman,132,103.515,6.15,637,2908,fc6855eee75919ea,Richard Phillips Feynman was an American physicist known for his work in the physics of the atomic nucleus and particle interactions through quantum field theory. He was a professor at the California Institute of Technology (Caltech) and is widely regarded as one of the greatest physicists of the 20,OK
2026-06-09 21:00:42,v23_D2_hf,tqy-HP-Z240-WS-HALRandD,Quadro M4000,2.5.1+cu121,float16,hf_direct,1,0.1,Qwen/Qwen2.5-3B-Instruct,CR4,正多面体サスペンス,132,123.143,5.77,711,1039,e2576be6f8a5f4d8,"もちろん、お手伝いします。では、この短編サスペンスは「正十二面体」をテーマにします。

タイトル：「十二面の秘密」

ある日、建築家・田中は自宅の玄関ホールに不思議な光景を目撃した。壁の一部が無理矢理に取り払われ、その穴には正十二面体の模型が置かれていた。その模型は、まるで何かを隠しているかのようだった。

田中は模型を手に取り、その形状と数を確認した。正十二面体は12つの面を持つ立体で、その面は全て等しい正五角形で構成されている。そして、その模型の一部が欠けていた。

田中は模型を部屋の隅に置き、夜の静寂の中でそれを眺めていた。その時、部屋の隅から微かな音が聞こえてきた。それは、正十二面体の",OK
2026-06-09 21:00:58,v23_D2_hf,tqy-HP-Z240-WS-HALRandD,Quadro M4000,2.5.1+cu121,float16,hf_direct,1,0.1,Qwen/Qwen2.5-3B-Instruct,CR2,素数と詩,132,16.219,9.31,151,204,771baa92e3e4d9af,"選んだ素数は、13です。

十三の光，夜の星，
暗闇から照らす希望の灯。
数の王，無限の秘密，
心の深さに響く音。

十三の名，厳しく，
奇跡の数，運命の結び目。
その数に宿る力，
人生の旅路を彩る秘訣。

十三の影，孤独の道，
しかし、それは勇気の源。
その数に包まれた心，
世界を越える翼を持つ。

十三の詩，シンプルだが深い，
数の神秘を歌う歌。
13, あなたの名は詩の核心に，
宇宙の秘密を告げる。",OK
2026-06-09 21:01:34,v23_D2_hf,tqy-HP-Z240-WS-HALRandD,Quadro M4000,2.5.1+cu121,float16,hf_direct,1,0.1,Qwen/Qwen2.5-3B-Instruct,FY,Feynman,133,36.247,8.14,295,1496,0feff3b23889d2a2,"Richard Phillips Feynman was an American physicist known for his groundbreaking work in quantum mechanics and particle physics. He was also a Nobel laureate, having received the Nobel Prize in Physics in 1965 along with Julian Schwinger and Shinichiro Tomonaga for developing new principles to unders",OK
2026-06-09 21:02:56,v23_D2_hf,tqy-HP-Z240-WS-HALRandD,Quadro M4000,2.5.1+cu121,float16,hf_direct,1,0.1,Qwen/Qwen2.5-3B-Instruct,CR4,正多面体サスペンス,133,81.82,6.54,535,819,00ed0ddf01de994e,"もちろん、お手伝いします。では、この短編サスペンスは「正四面体」を舞台に設定します。

タイトル：「四面の秘密」

ある日、建築家の山田は、彼の古い友人・佐藤から、彼が遺した正四面体の模型を譲り受けました。それは、佐藤が亡くなった後、彼の部屋から見つかったものでした。山田は、その形状と名前から、これは正四面体の模型だとすぐに気づきました。

山田は、佐藤が亡くなった理由についての詳細な情報を得られず、正四面体の模型を研究することにしました。その模型は、まるで生命の象徴のように、四つの角が尖った形をしていました。

ある夜、山田は模型を部屋の隅に置き、眠ろうとしたとき、突然、模型が動き始めました",OK
2026-06-09 21:03:07,v23_D2_hf,tqy-HP-Z240-WS-HALRandD,Quadro M4000,2.5.1+cu121,float16,hf_direct,1,0.1,Qwen/Qwen2.5-3B-Instruct,CR2,素数と詩,133,11.248,9.78,110,155,01970ac35c823d56,"選んだ素数は、13です。

十三の光，夜の守り手
暗闇に照らし、心を温める
無限の数の一部
静かに存在し、輝く

十三は孤独でもあり、
しかし、その孤独が強さを増す
それは、一つしかない
その美しさと力

この詩は、13という素数の特性や意味を表現しています。孤独感や特別さ、そしてその強さなどを表現しました。",OK
2026-06-09 21:03:58,v23_D2_hf,tqy-HP-Z240-WS-HALRandD,Quadro M4000,2.5.1+cu121,float16,hf_direct,1,0.1,Qwen/Qwen2.5-3B-Instruct,FY,Feynman,134,51.069,7.52,384,2025,0f34acd6b125a0c6,"Richard Phillips Feynman was an American physicist known for his groundbreaking work in quantum mechanics and particle physics. He was also a Nobel laureate, having won the Nobel Prize in Physics in 1965 along with Julian Schwinger and Shinichiro Tomonaga for developing new principles for describing",OK
2026-06-09 21:07:25,v23_D2_hf,tqy-HP-Z240-WS-HALRandD,Quadro M4000,2.5.1+cu121,float16,hf_direct,1,0.1,Qwen/Qwen2.5-3B-Instruct,CR4,正多面体サスペンス,134,206.948,4.83,1000,1412,aaacd6782ff2145d,"もちろん、お手伝いします。では、この短編サスペンスは「正四面体」を舞台にします。

タイトル：「四面の秘密」

ある日、建築家の山田は、彼の古い友人・佐藤から、彼が遺した謎めいた正四面体の模型を譲り受けました。正四面体は、全ての面が等しい三角形で構成される立体で、その神秘的な形状と数理的な特性から、多くの人々に興味を引く存在でした。

山田は、佐藤が亡くなった後、彼の遺品を探していたところ、この正四面体を見つけました。彼は、佐藤が亡くなった直前、この正四面体について何か重要なことを言っていたことを思い出しました。しかし、具体的な内容は忘れていました。

山田は、正四面体の各頂点に小さな穴を開け",OK
2026-06-09 21:07:40,v23_D2_hf,tqy-HP-Z240-WS-HALRandD,Quadro M4000,2.5.1+cu121,float16,hf_direct,1,0.1,Qwen/Qwen2.5-3B-Instruct,CR2,素数と詩,134,14.38,9.46,136,181,8da849224bd98672,"選んだ素数は、13です。

十三の光，夜の守り手
暗闇に照らし、心を温める
無限の数の一部
静かに存在し、輝く

この詩では、13という素数を象徴的に扱っています。十三は、月経周期や占星術などで重要な役割を果たす数字でもあります。また、暗闇を照らす光や、心を温めるものとして表現しました。そして、無限の数の中の一員として、静かに存在し続ける13を描いてみました。",OK
2026-06-09 21:09:55,v23_D2_hf,tqy-HP-Z240-WS-HALRandD,Quadro M4000,2.5.1+cu121,float16,hf_direct,1,0.1,Qwen/Qwen2.5-3B-Instruct,FY,Feynman,135,135.807,5.63,765,3614,cbef7b5fcd59d4bc,Richard Phillips Feynman was an American physicist known for his work in the physics of the atomic nucleus and particle interactions through quantum field theory. He was a professor at the California Institute of Technology (Caltech) and is widely regarded as one of the greatest physicists of the 20,OK
