timestamp,experiment,hostname,gpu,torch_ver,dtype,framework,batch_size,temperature,model,tc_id,tc_name,run,elapsed_sec,tok_per_sec,gen_tokens,reply_len,reply_hash,reply,status
2026-06-10 02:31:16,v23_D2_hf,tqy-HP-Z240-WS-HALRandD,Quadro M4000,2.5.1+cu121,float16,hf_direct,1,0.1,Qwen/Qwen2.5-3B-Instruct,CR2,素数と詩,246,11.249,9.78,110,149,c63dc27362c1409f,"選んだ素数は、13です。

十三の光，夜の星，
暗闇に燃え盛る希望の火。
無限の数の一部，
静かに輝き続ける。

十三の節，時を刻む，
四季の変化，運命の流れ。
それぞれが独自の美，
組み合わさって壮大なる詩。

十三の心，深く静か，
孤独の中でも強い力。
その強さは無限，
全てを包み込む愛の詩。",OK
2026-06-10 02:32:35,v23_D2_hf,tqy-HP-Z240-WS-HALRandD,Quadro M4000,2.5.1+cu121,float16,hf_direct,1,0.1,Qwen/Qwen2.5-3B-Instruct,FY,Feynman,247,78.899,6.68,527,2578,865a2262ecf960aa,"Richard Phillips Feynman was an American physicist known for his groundbreaking work in quantum mechanics and particle physics. He was also a renowned educator and popular science writer. Here are some key points about him:

1. **Early Life and Education**: Feynman was born on May 11, 1918, in Far R",OK
2026-06-10 02:34:14,v23_D2_hf,tqy-HP-Z240-WS-HALRandD,Quadro M4000,2.5.1+cu121,float16,hf_direct,1,0.1,Qwen/Qwen2.5-3B-Instruct,CR4,正多面体サスペンス,247,98.895,6.19,612,986,a5a9e513553a3185,"もちろん、お手伝いします。では、この短編サスペンスは「正十二面体」をテーマにします。

タイトル：「十二面の秘密」

ある日、建築家のリチャードは、彼の新しいプロジェクトのために、正十二面体の模型を作成することにしました。彼はその形状が美しいと感じ、また、その構造が他の正多面体よりも独特であることに興奮していました。

リチャードは模型を完成させ、それを自宅の地下室に保管しました。しかし、彼はその模型が何か特別な意味を持つことを知りませんでした。

数週間後、リチャードはモデルを再び取り出そうとしたとき、彼は驚愕しました。模型は、何らかの不思議な力によって、微妙に歪んでいました。そして、その歪",OK
2026-06-10 02:34:25,v23_D2_hf,tqy-HP-Z240-WS-HALRandD,Quadro M4000,2.5.1+cu121,float16,hf_direct,1,0.1,Qwen/Qwen2.5-3B-Instruct,CR2,素数と詩,247,11.606,9.74,113,149,b30d20f7369d7d1b,"選んだ素数は、13です。

十三の光，夜の守り手
暗闇に輝き，心を照らす
無限の秘密，その奥深さ
13，あなたの存在は不思議

この詩では、素数13を象徴的に扱っています。13は、多くの文化や伝統において特別な意味を持ちます。また、暗闇や不思議な世界を表現することで、13の神秘性を強調しています。",OK
2026-06-10 02:35:18,v23_D2_hf,tqy-HP-Z240-WS-HALRandD,Quadro M4000,2.5.1+cu121,float16,hf_direct,1,0.1,Qwen/Qwen2.5-3B-Instruct,FY,Feynman,248,53.081,7.44,395,1888,fbafa3c987a4bbd0,"Richard Phillips Feynman was an American physicist known for his groundbreaking work in the path integral formulation of quantum mechanics, for his demonstrations of the principles of quantum electrodynamics, and for the development of quantum computing, superfluidity, and dynamical friction. He was",OK
2026-06-10 02:36:49,v23_D2_hf,tqy-HP-Z240-WS-HALRandD,Quadro M4000,2.5.1+cu121,float16,hf_direct,1,0.1,Qwen/Qwen2.5-3B-Instruct,CR4,正多面体サスペンス,248,91.146,6.34,578,856,30b97bfe2103207a,"もちろん、お手伝いします。では、この短編サスペンスは「正四面体」を舞台に設定します。

タイトル：「四面の秘密」

ある日、建築家・田中は自宅の玄関ホールに正四面体の形をした不思議な物体を見つけた。その形状は、彼が設計した自宅の一部だった。しかし、その物体はまるで存在しないかのように、無重力空間に浮遊していた。

田中の好奇心に駆られて、彼は物体を手に取り、その内部を探ることにした。すると、その物体は突然、内部から小さな扉を開き、一瞬のうちに巨大な地下室へと引き込まれてしまった。

地下室には、何世紀も前の古代文明の遺跡が広がっていた。そして、その中には、正四面体の形をした巨大な石像が鎮座して",OK
2026-06-10 02:37:02,v23_D2_hf,tqy-HP-Z240-WS-HALRandD,Quadro M4000,2.5.1+cu121,float16,hf_direct,1,0.1,Qwen/Qwen2.5-3B-Instruct,CR2,素数と詩,248,12.091,9.68,117,167,24df652e1a61a239,"選んだ素数は、13です。

十三の光，夜の守り手
暗闇に照らし、心を温める
無限の数の一部，静かに
世界を包み込む神秘

この詩は、13という素数の特性や神秘性を表現しています。特に、13は「 unlucky」という意味を持つ英語の慣用句で使われることがありますが、それとは対照的に、暗闇を照らす光や神秘的な要素を取り入れてみました。",OK
2026-06-10 02:37:37,v23_D2_hf,tqy-HP-Z240-WS-HALRandD,Quadro M4000,2.5.1+cu121,float16,hf_direct,1,0.1,Qwen/Qwen2.5-3B-Instruct,FY,Feynman,249,35.779,8.16,292,1519,77c537accce0e26c,Richard Phillips Feynman was an American physicist known for his work in the physics of the atomic nucleus and particle interactions through quantum field theory. He was awarded the Nobel Prize in Physics in 1965 along with Julian Schwinger and Sin-Itiro Tomonaga for developing new principles for de,OK
2026-06-10 02:39:29,v23_D2_hf,tqy-HP-Z240-WS-HALRandD,Quadro M4000,2.5.1+cu121,float16,hf_direct,1,0.1,Qwen/Qwen2.5-3B-Instruct,CR4,正多面体サスペンス,249,112.013,5.95,666,1003,85b271d4a1402ab4,"もちろん、お手伝いします。では、この短編サスペンスは「正四面体」を舞台に設定します。

タイトル：「四面の秘密」

ある日、建築家・田中は、友人である数学教師・山田から、彼が設計した最新のプロジェクトの模型を借りてほしいと依頼されました。それは、正四面体の模型でした。

田中は、山田の提案通り、正四面体の模型を完成させました。その形状は、四角形の底面と、四角形の頂点を結ぶ四本の直線で構成されていました。しかし、その模型には不思議な力を感じました。

ある夜、田中はモデルを部屋に置いて、研究室に戻ろうとしたとき、突然、部屋が揺れ始めました。そして、その揺れは次第に大きくなり、部屋は真っ暗になり、",OK
2026-06-10 02:39:42,v23_D2_hf,tqy-HP-Z240-WS-HALRandD,Quadro M4000,2.5.1+cu121,float16,hf_direct,1,0.1,Qwen/Qwen2.5-3B-Instruct,CR2,素数と詩,249,12.556,9.64,121,164,3c930a1bd8234879,"選んだ素数は、13です。

十三の光，夜の守り手
暗闇に照らし、心を温める
無限の数の一部
静かに存在し、輝く

十三は孤独でもあり、
しかし、その孤独が強さを増す
それは、他の数とは異なる
特別な存在である

この詩は、13という素数の特徴や神秘性を表現しています。孤独と強さ、特別さなど、13の象徴的な要素を取り入れました。",OK
2026-06-10 02:40:33,v23_D2_hf,tqy-HP-Z240-WS-HALRandD,Quadro M4000,2.5.1+cu121,float16,hf_direct,1,0.1,Qwen/Qwen2.5-3B-Instruct,FY,Feynman,250,51.049,7.52,384,2051,63ed90bad1addf62,"Richard Phillips Feynman was an American physicist known for his groundbreaking work in quantum mechanics and particle physics. He was also a Nobel laureate, having won the Nobel Prize in Physics in 1965 along with Julian Schwinger and Shinichiro Tomonaga for developing new principles to understand ",OK
2026-06-10 02:41:35,v23_D2_hf,tqy-HP-Z240-WS-HALRandD,Quadro M4000,2.5.1+cu121,float16,hf_direct,1,0.1,Qwen/Qwen2.5-3B-Instruct,CR4,正多面体サスペンス,250,61.963,7.07,438,650,4200f1091219232c,"もちろん、お手伝いします。では、この短編サスペンスは「正十二面体」をテーマにします。

タイトル：「十二面の秘密」

ある日、建築家・田中は自宅の地下室に新しいプロジェクトの模型を見つけた。それは正十二面体のモデルだった。彼は興奮しながら模型を眺めていたが、その時、地下室の扉が突然開いた。扉の向こうには、誰もいない。しかし、扉の隙間から薄暗さが漏れていた。

田中は驚きながらも、模型の詳細を確認し始めた。その模型は、まるで何かを隠しているかのようだ。そして、その模型の一部に、小さな穴が開いていた。田中はそれを指で押し広げると、小さな光が漏れ出していた。

その光の元には、一本の長い管が伸びてい",OK
2026-06-10 02:41:53,v23_D2_hf,tqy-HP-Z240-WS-HALRandD,Quadro M4000,2.5.1+cu121,float16,hf_direct,1,0.1,Qwen/Qwen2.5-3B-Instruct,CR2,素数と詩,250,18.353,9.15,168,228,4d50620bbe6e0c25,"選んだ素数は、13です。

十三の光，夜の守り手
暗闇に照らし、心を温める
無限の数の一部，神秘の花
静かに舞い踊る，その存在

十三の名，孤独の歌
世界の端に立つ勇気ある者へ
その力は、困難を越える翼
心の深淵から、希望への道

この詩は、13という素数の神秘性や、その独自の美しさを表現しようと試みました。十三は、多くの文化や伝統において特別な意味を持ちますが、それらを具体的に取り入れる代わりに、一般的な象徴としての「孤独」や「希望」を表現しました。",OK
2026-06-10 02:43:57,v23_D2_hf,tqy-HP-Z240-WS-HALRandD,Quadro M4000,2.5.1+cu121,float16,hf_direct,1,0.1,Qwen/Qwen2.5-3B-Instruct,FY,Feynman,251,123.312,5.82,718,3518,8e957884c1c82ea7,"Richard Phillips Feynman was an American physicist known for his groundbreaking work in the path integral formulation of quantum mechanics, for his demonstrations of the principles of quantum electrodynamics, and for the development of quantum computing, superfluidity, and dynamical friction. He was",OK
2026-06-10 02:45:35,v23_D2_hf,tqy-HP-Z240-WS-HALRandD,Quadro M4000,2.5.1+cu121,float16,hf_direct,1,0.1,Qwen/Qwen2.5-3B-Instruct,CR4,正多面体サスペンス,251,98.918,6.19,612,979,d014f3d511ce6260,"もちろん、お手伝いします。では、この短編サスペンスは「正十二面体」をテーマにします。

タイトル：「十二面の秘密」

ある日、建築家のリチャードは、彼の新しいプロジェクトのために、正十二面体の模型を作成することにしました。彼はその形状の美しさと複雑さに魅了され、数日間、夜も朝もその模型に没頭していました。

リチャードは、正十二面体の各頂点に12個の三角形が集まり、その面は全て等しい長方形で囲まれていることを知っています。しかし、彼はその秘密を解き明かすための鍵を見つけることができませんでした。

ある夜、リチャードはモデルの最上部にある一つの三角形の頂点に目を落としていました。その瞬間、彼は",OK
2026-06-10 02:45:56,v23_D2_hf,tqy-HP-Z240-WS-HALRandD,Quadro M4000,2.5.1+cu121,float16,hf_direct,1,0.1,Qwen/Qwen2.5-3B-Instruct,CR2,素数と詩,251,20.37,9.03,184,241,408352d1338d2ad2,"選んだ素数は、13です。

十三の光，夜の星，
暗闇から照らす希望の灯。
無限の数に名を刻む，
その強さと純粋さ。

十三の道，困難の壁，
しかし進む勇気を育てる。
挑戦への扉を開く，
その力強いメッセージ。

十三の夢，不思議な旅，
未知の世界へ導く指針。
心の深みに響く歌，
その神秘と美しさ。

十三の愛，深遠なる心，
つながりを結ぶ強靭な紐。
共鳴する心音を奏でる，
その温もりと優しさ。

十三は、数の王様，
その神秘と強さに感嘆。
私たちの生活を彩る，
その存在と価値。",OK
2026-06-10 02:47:46,v23_D2_hf,tqy-HP-Z240-WS-HALRandD,Quadro M4000,2.5.1+cu121,float16,hf_direct,1,0.1,Qwen/Qwen2.5-3B-Instruct,FY,Feynman,252,110.561,6.02,666,3174,434878dfc11e6ecd,Richard Phillips Feynman was an American physicist known for his work in the physics of the atomic nucleus and particle interactions through quantum field theory. He was a professor at the California Institute of Technology (Caltech) and is widely regarded as one of the greatest physicists of the 20,OK
2026-06-10 02:49:03,v23_D2_hf,tqy-HP-Z240-WS-HALRandD,Quadro M4000,2.5.1+cu121,float16,hf_direct,1,0.1,Qwen/Qwen2.5-3B-Instruct,CR4,正多面体サスペンス,252,76.66,6.67,511,754,fc077ae6fb8eb668,"もちろん、お手伝いします。では、この短編サスペンスは「正四面体」を舞台に設定します。

タイトル：「四面の秘密」

ある日、建築家・田中は、彼が設計した最新のプロジェクトの模型を完成させた。それは、正四面体の形状をした巨大な建物で、その内部には複雑な装置が組み込まれていた。田中は、この建物が完成したら、世界中の科学者たちを驚かせると確信していた。

しかし、その夜、田中は突然、建物の一部が不規則に動くのを見た。それは、正四面体の各辺がゆっくりと回転し始めたのだ。最初は微細な動きだったが、徐々に大きくなっていった。建物の内部は暗く、その動きはまるで生命のように感じられた。

田中はすぐに警察に連",OK
2026-06-10 02:49:16,v23_D2_hf,tqy-HP-Z240-WS-HALRandD,Quadro M4000,2.5.1+cu121,float16,hf_direct,1,0.1,Qwen/Qwen2.5-3B-Instruct,CR2,素数と詩,252,12.806,9.6,123,171,9efe7e18a3c30328,"選んだ素数は、13です。

十三の光，夜の守り手
暗闇に照らし、心を温める
無限の数の一部
静かに存在し、輝く

十三は孤独でもあり、
しかし、その孤独が強さを増す
それは、個性と独立を象徴する
世界の一部でありながら、またそれ自体

この詩は、13という素数の特性や意味を表現しています。孤独と強さ、個性と独立といった要素を取り入れました。",OK
2026-06-10 02:49:52,v23_D2_hf,tqy-HP-Z240-WS-HALRandD,Quadro M4000,2.5.1+cu121,float16,hf_direct,1,0.1,Qwen/Qwen2.5-3B-Instruct,FY,Feynman,253,35.776,8.16,292,1557,674040de965c3f1c,"Richard Phillips Feynman was an American physicist known for his groundbreaking work in quantum mechanics and particle physics. He was also a Nobel laureate, having received the Nobel Prize in Physics in 1965 along with Julian Schwinger and Sin-Itiro Tomonaga for developing new principles to underst",OK
2026-06-10 02:51:31,v23_D2_hf,tqy-HP-Z240-WS-HALRandD,Quadro M4000,2.5.1+cu121,float16,hf_direct,1,0.1,Qwen/Qwen2.5-3B-Instruct,CR4,正多面体サスペンス,253,99.633,6.17,615,853,3b37a78c7c903c8d,"もちろん、お手伝いします。では、この短編サスペンスは「正四面体」を舞台に設定します。

タイトル：「四面の秘密」

ある日、建築家・田中は自宅の玄関から突然現れた謎の人物に出会った。その人物は、田中の家の正四面体形状の屋根の一部を指さし、何かを告げようとした。その瞬間、田中の心は一気に冷えてしまった。

その人物はすぐに姿を消し、田中はその謎に取り憑かれるようになった。その夜、田中の夢の中で、正四面体の各頂点が次々と動き出し、それぞれが別の世界へと旅立っていく様子を見た。その夢は、彼の心に深い恐怖と不安を植え付けることとなった。

数日後、田中の家の屋根の一部が不意に崩れ落ちた。その崩落の瞬間",OK
2026-06-10 02:51:46,v23_D2_hf,tqy-HP-Z240-WS-HALRandD,Quadro M4000,2.5.1+cu121,float16,hf_direct,1,0.1,Qwen/Qwen2.5-3B-Instruct,CR2,素数と詩,253,14.748,9.43,139,174,17f08616dfb22812,"選んだ素数は、13です。

十三の光，夜の守り手
暗闇に照らし、心を温める
無限の数の一部，神秘の花
静かに舞い踊る，その存在

十三の名，厳しく
世界の端から始まり、また終わり
奇跡の数，運命の刻み
すべての物語に、隠された秘密

十三の力，強靭で
困難を乗り越え、新たな道を開く
孤独の中でも、勇気を振り絞る
その力は、詩と歌と共に、永遠に続く",OK
2026-06-10 02:53:03,v23_D2_hf,tqy-HP-Z240-WS-HALRandD,Quadro M4000,2.5.1+cu121,float16,hf_direct,1,0.1,Qwen/Qwen2.5-3B-Instruct,FY,Feynman,254,77.399,6.72,520,2557,ad7d4f37beda3a28,"Richard Phillips Feynman was an American physicist known for his groundbreaking work in quantum mechanics and particle physics. He was also a renowned educator and popular science writer. Here are some key points about him:

1. **Early Life and Education**: Feynman was born on May 11, 1918, in Far R",OK
2026-06-10 02:54:01,v23_D2_hf,tqy-HP-Z240-WS-HALRandD,Quadro M4000,2.5.1+cu121,float16,hf_direct,1,0.1,Qwen/Qwen2.5-3B-Instruct,CR4,正多面体サスペンス,254,57.841,7.19,416,578,1a2b9c7411bee1e3,"もちろん、お手伝いします。では、この短編サスペンスは「正四面体」を舞台にします。

タイトル：「四面の秘密」

ある日、建築家の山田は、彼の古い友人・佐藤から、彼が遺した謎めいた正四面体の模型を譲り受けました。正四面体は、全ての面が等しい三角形で構成される立体で、その神秘的な形状に山田は興味を持ちました。

佐藤は亡くなった直前に、山田に正四面体の秘密を教えてくれと頼んでいました。しかし、彼の死後、その秘密は消え失せてしまいました。山田は、正四面体の秘密を解き明かすため、佐藤の遺品を探し始めました。

その夜、山田は正四面体の模型を部屋の隅に置き、それを眺めていました。突然、部屋の隅から小さな",OK
2026-06-10 02:54:12,v23_D2_hf,tqy-HP-Z240-WS-HALRandD,Quadro M4000,2.5.1+cu121,float16,hf_direct,1,0.1,Qwen/Qwen2.5-3B-Instruct,CR2,素数と詩,254,10.294,9.91,102,125,86c802036c4b8839,"選んだ素数は、13です。

十三の光，夜の守り手
暗闇に輝き，静かに
無数の星より遥か遠く
孤独な旅人へ

十三の名，厳しく
風と雨，嵐と静けさ
全てを受け入れ
心の深みに響く

十三の力，秘められた
それは隠された道
未知なる世界への
扉を開く勇気",OK
2026-06-10 02:54:44,v23_D2_hf,tqy-HP-Z240-WS-HALRandD,Quadro M4000,2.5.1+cu121,float16,hf_direct,1,0.1,Qwen/Qwen2.5-3B-Instruct,FY,Feynman,255,32.549,8.33,271,1376,c560b858ffd55a4c,Richard Phillips Feynman was an American physicist known for his work in the physics of the atomic nucleus and particle interactions through quantum field theory. He was awarded the Nobel Prize in Physics in 1965 along with Julian Schwinger and Sin-Itiro Tomonaga for developing new principles for de,OK
2026-06-10 02:56:05,v23_D2_hf,tqy-HP-Z240-WS-HALRandD,Quadro M4000,2.5.1+cu121,float16,hf_direct,1,0.1,Qwen/Qwen2.5-3B-Instruct,CR4,正多面体サスペンス,255,80.718,6.57,530,798,79237e6049835e12,"もちろん、お手伝いします。では、この短編サスペンスは「正四面体」を舞台にします。

タイトル：「四面の秘密」

ある日、建築家の山田は、彼の古い友人・佐藤から、彼が遺した謎めいた正四面体の模型を譲り受けました。正四面体は、全ての面が等しい三角形で構成される立体で、その神秘的な形状に山田は興味を持ちました。

佐藤は亡くなった直前に、山田に正四面体の秘密を教えてくれと頼んだのだそうでした。しかし、彼の死後、その秘密は消え失せてしまったのです。

山田は正四面体のモデルを手に取り、その四つの面を眺めていました。それぞれの面には、小さな穴が開いており、穴の中には小さな紙片が入っていました。山田は一つ",OK
2026-06-10 02:56:18,v23_D2_hf,tqy-HP-Z240-WS-HALRandD,Quadro M4000,2.5.1+cu121,float16,hf_direct,1,0.1,Qwen/Qwen2.5-3B-Instruct,CR2,素数と詩,255,12.686,9.62,122,165,2a31c1358adc135a,"選んだ素数は、13です。

十三の光，夜の守り手
暗闇に照らし、心を温める
無限の数の一部
静かに存在し、輝く

十三の名は、孤独と
神秘に満ち溢れています
それは、偶然の産物でも
必然の結果でもない

十三の道，困難を経て
達成される真理への扉
その門には、答えが隠されています
しかし、それを見つけるのは
勇気と智慧が必要です",OK
2026-06-10 02:57:07,v23_D2_hf,tqy-HP-Z240-WS-HALRandD,Quadro M4000,2.5.1+cu121,float16,hf_direct,1,0.1,Qwen/Qwen2.5-3B-Instruct,FY,Feynman,256,49.818,7.57,377,1910,48473e506dc7efb0,Richard Phillips Feynman was an American physicist known for his work in the physics of the atomic nucleus and particle interactions through quantum field theory. He was a professor at the California Institute of Technology (Caltech) and is widely regarded as one of the greatest physicists of the 20,OK
2026-06-10 02:58:21,v23_D2_hf,tqy-HP-Z240-WS-HALRandD,Quadro M4000,2.5.1+cu121,float16,hf_direct,1,0.1,Qwen/Qwen2.5-3B-Instruct,CR4,正多面体サスペンス,256,74.122,6.73,499,705,e1e620a7cdc55df5,"もちろん、お手伝いします。では、この短編サスペンスは「正十二面体」をテーマにします。

タイトル：「十二面の秘密」

ある日、建築家・田中は自宅の玄関ホールに不思議な光景を目撃した。壁の一部が開き、そこには正十二面体の形をした巨大な扉が現れ、その中に何もない空間が広がっていた。扉の上には、謎めいた文字が刻まれていた。

田中はその扉を開けた。内部は空洞で、ただ一つの小さな穴が開いていた。その穴から、不気味な音が聞こえてきた。田中は戸惑いながらも、穴を指先で触った。その瞬間、彼の体が冷たくなった。そして、穴から次第に光が溢れ出し、その光は徐々に田中の体内へと侵食していった。

田中は意識を失った",OK
2026-06-10 02:58:37,v23_D2_hf,tqy-HP-Z240-WS-HALRandD,Quadro M4000,2.5.1+cu121,float16,hf_direct,1,0.1,Qwen/Qwen2.5-3B-Instruct,CR2,素数と詩,256,15.855,9.33,148,180,a565e97f2bcb6996,"選んだ素数は、13です。

十三の光，夜の守り手
暗闇に輝き，静かに
無数の星より遠く
孤独な旅人へ

十三の名，厳しく
風と雨，嵐と静けさ
全てを試す勇気
その力は強き

十三の心，深く
歴史の重みを背負う
過去と未来の橋
つなぐ存在

十三の夢，不思議
未知なる世界への
探求心と好奇心
希望の芽生え

十三の詩，シンプル
しかし深い
素数の秘密
心に響く",OK
2026-06-10 02:59:11,v23_D2_hf,tqy-HP-Z240-WS-HALRandD,Quadro M4000,2.5.1+cu121,float16,hf_direct,1,0.1,Qwen/Qwen2.5-3B-Instruct,FY,Feynman,257,33.768,8.26,279,1463,480683b3b0af76c9,Richard Phillips Feynman was an American physicist known for his work in the physics of the atomic nucleus and particle interactions through quantum field theory. He was awarded the Nobel Prize in Physics in 1965 along with Julian Schwinger and Sin-Itiro Tomonaga for developing new principles for de,OK
2026-06-10 03:00:43,v23_D2_hf,tqy-HP-Z240-WS-HALRandD,Quadro M4000,2.5.1+cu121,float16,hf_direct,1,0.1,Qwen/Qwen2.5-3B-Instruct,CR4,正多面体サスペンス,257,91.759,6.33,581,877,04a12afe0002a76e,"もちろん、お手伝いします。では、この短編サスペンスは「正十二面体」をテーマにします。

タイトル：「十二面の秘密」

ある日、建築家・田中は自宅の玄関ホールに不思議な光景を目撃した。壁の一部が開き、そこには正十二面体の形をした巨大な扉が現れ、その中に何もない空間が広がっていた。扉の上には、謎めいた言葉が刻まれていた。「ここにいる者は、十二面の秘密を知る者である。」

田中はその扉を開けた。内部は完全に暗く、何も見えない。しかし、彼の足元に何かが動いた。それは、正十二面体の各頂点に設置された小さなスピーカーから聞こえてきた声だった。「あなたは、十二面の秘密を知りたいと願っている。それには、十二面",OK
2026-06-10 03:00:54,v23_D2_hf,tqy-HP-Z240-WS-HALRandD,Quadro M4000,2.5.1+cu121,float16,hf_direct,1,0.1,Qwen/Qwen2.5-3B-Instruct,CR2,素数と詩,257,11.245,9.78,110,153,684dc7ceacf9f278,"選んだ素数は、13です。

十三の光，夜の守り手
暗闇に照らし、心を温める
無限の数の一部
静かに存在し、輝く

十三は孤独でもあり、
しかし、その孤独が強さを増す
それは、一つしかない
その美しさと力

この詩は、13という素数の特性や意味を表現しています。孤独感や特別さ、そしてその強さを表現しました。",OK
