timestamp,experiment,hostname,gpu,torch_ver,dtype,framework,batch_size,temperature,model,tc_id,tc_name,run,elapsed_sec,tok_per_sec,gen_tokens,reply_len,reply_hash,reply,status
2026-06-09 14:30:08,v23_D2_hf,tqy-HP-Z240-WS-HALRandD,Quadro M4000,2.5.1+cu121,float16,hf_direct,1,0.1,Qwen/Qwen2.5-3B-Instruct,FY,Feynman,1,41.184,7.5,309,1558,10b8c8c7fd5534c7,Richard Phillips Feynman was an American physicist known for his work in the physics of the atomic nucleus and particle interactions through quantum field theory. He was a professor at the California Institute of Technology (Caltech) and is widely regarded as one of the greatest physicists of the 20,OK
2026-06-09 14:30:43,v23_D2_hf,tqy-HP-Z240-WS-HALRandD,Quadro M4000,2.5.1+cu121,float16,hf_direct,1,0.1,Qwen/Qwen2.5-3B-Instruct,CR4,正多面体サスペンス,1,34.59,7.75,268,383,7d21d86f18b8b363,"もちろん、お手伝いします。では、この短編サスペンスは「正四面体」を舞台にします。

タイトル：「四面の秘密」

ある日、建築家・田中は自宅の玄関から突然現れた謎の人物に出会った。彼は田中の家の正四面体形状の屋根の一部を指さし、その秘密について語り始めた。その人物は「正四面体」という形が持つ神秘性を理解していると、田中は驚いた。彼はその人物に、正四面体の屋根の一部を修理するための材料を貸してほしいと頼んだ。

その夜、田中の部屋には不気味な光景が現れた。正四面体の屋根の一部が、まるで生命のように動いていた。その動きは、まるで何かがその内部に潜んでいるかのようだった。そして、その中にあったのは、田",OK
2026-06-09 14:30:56,v23_D2_hf,tqy-HP-Z240-WS-HALRandD,Quadro M4000,2.5.1+cu121,float16,hf_direct,1,0.1,Qwen/Qwen2.5-3B-Instruct,CR2,素数と詩,1,13.419,9.09,122,168,4e7690187c88bde2,"選んだ素数は、13です。

十三の光，夜の守り手
暗闇に照らし、心を温める
無限の数の一部
静かに存在し、輝く

十三の名は、孤独と
神秘に満ち溢れています
それは、偶然の産物でも
必然の結果でもありません

十三の道，困難を経て
達成される真理への扉
その門には、答えが隠されています
しかし、それを見つけるのは
勇気と智慧が必要です",OK
2026-06-09 14:31:44,v23_D2_hf,tqy-HP-Z240-WS-HALRandD,Quadro M4000,2.5.1+cu121,float16,hf_direct,1,0.1,Qwen/Qwen2.5-3B-Instruct,FY,Feynman,2,48.164,7.45,359,1878,3d6e566fd3b7f6ae,Richard Phillips Feynman was an American physicist known for his work in the physics of the atomic nucleus and particle interactions through quantum field theory. He was a professor at the California Institute of Technology (Caltech) and is widely regarded as one of the greatest physicists of the 20,OK
2026-06-09 14:32:47,v23_D2_hf,tqy-HP-Z240-WS-HALRandD,Quadro M4000,2.5.1+cu121,float16,hf_direct,1,0.1,Qwen/Qwen2.5-3B-Instruct,CR4,正多面体サスペンス,2,63.069,7.04,444,616,c427f3f701756db8,"もちろん、お手伝いします。では、この短編サスペンスは「正四面体」を舞台に設定します。

タイトル：「四面の秘密」

ある日、建築家・田中は自宅の玄関から突然現れた謎の人物に出会った。その人物は、田中の家の正四面体形状の屋根の一部を指さし、何かを告げるかのように言った。「ここが秘密の入口だよ」と。

田中は最初、その人物の言葉を信じなかった。しかし、その人物が指さした部屋には、誰も住んでいない空っぽの部屋だった。しかし、その部屋の壁には、正四面体の各頂点に穴が開いていた。

その夜、田中はその穴を通じて、正四面体の各頂点へと足跡をつけた。各頂点には、それぞれ異なる秘密が隠されていた。そして、最終",OK
2026-06-09 14:33:07,v23_D2_hf,tqy-HP-Z240-WS-HALRandD,Quadro M4000,2.5.1+cu121,float16,hf_direct,1,0.1,Qwen/Qwen2.5-3B-Instruct,CR2,素数と詩,2,19.626,9.07,178,253,0a310ec68c4a7aa1,"選んだ素数は、13です。

十三の光，夜の星，
暗闇から照らす勇気，
心に響く音，
無限の可能性を告げる。

十三の節，時を刻む，
日々の終わりと始まり，
それぞれが独自の意味を持つ，
その数には深遠なる意味がある。

十三の夢，空高く舞う，
達成感と希望の羽根，
困難を越えて進む，
その道程は険しくも美しい。

十三の旅，未知への挑戦，
新たな視点と発見へ向かう，
迷いも経験となり，
成長の糧となる。

十三の詩，シンプルだが力強い，
素数の魅力を歌う，
その数は永遠に続く，
十三の詩は永遠に続く。",OK
2026-06-09 14:33:44,v23_D2_hf,tqy-HP-Z240-WS-HALRandD,Quadro M4000,2.5.1+cu121,float16,hf_direct,1,0.1,Qwen/Qwen2.5-3B-Instruct,FY,Feynman,3,37.51,8.08,303,1571,4178242ac3767941,"Richard Phillips Feynman was an American physicist known for his groundbreaking work in quantum mechanics and particle physics. He was also a Nobel laureate, having received the Nobel Prize in Physics in 1965 along with Julian Schwinger and Sin-Itiro Tomonaga for developing new principles to underst",OK
2026-06-09 14:35:44,v23_D2_hf,tqy-HP-Z240-WS-HALRandD,Quadro M4000,2.5.1+cu121,float16,hf_direct,1,0.1,Qwen/Qwen2.5-3B-Instruct,CR4,正多面体サスペンス,3,119.429,5.82,695,1117,5521045516594970,"もちろん、お手伝いします。では、この短編サスペンスは「正四面体」を舞台にします。

タイトル：「四面の秘密」

ある日、建築家のリチャードは、彼の古い友人であるジョンと再会しました。ジョンは数年ぶりに訪ねてきたリチャードの家にやってきたのです。リチャードの家は、彼が学生時代に設計した、正四面体形状の小さな家でした。

ジョンは、リチャードが設計したその家について話すと、突然、彼の表情が険しくなりました。「リチャード、君の設計した家には何か不思議な出来事があったんだ。」と彼は告げます。

リチャードは驚き、しかし、好奇心を抑えられませんでした。ジョンは、彼の設計した家が正四面体の形をしていること",OK
2026-06-09 14:36:06,v23_D2_hf,tqy-HP-Z240-WS-HALRandD,Quadro M4000,2.5.1+cu121,float16,hf_direct,1,0.1,Qwen/Qwen2.5-3B-Instruct,CR2,素数と詩,3,22.431,8.92,200,278,17c56cc57d1a8213,"選んだ素数は、13です。

十三の光，夜の星，
暗闇から照らす希望の輝き。
無限の数に名を刻む，
その強さと純粋さ。

十三の節目，新たな始まり，
困難を乗り越え、成長の道。
心の深みに響く旋律，
勇気と希望の歌。

十三の夢，遠くへの旅，
未知なる世界へ向かう勇気。
静かな夜空の星屑，
その光が導く未来へ。

この詩は、13という素数の特性や意味を表現するために作られました。特に、13は「厄年」として知られる一方で、同時に「運命の数字」とも呼ばれています。また、13は数学的な観点からも魅力的で、例えばフィボナッチ数列では13が重要な位置を占めます。",OK
2026-06-09 14:36:49,v23_D2_hf,tqy-HP-Z240-WS-HALRandD,Quadro M4000,2.5.1+cu121,float16,hf_direct,1,0.1,Qwen/Qwen2.5-3B-Instruct,FY,Feynman,4,42.547,7.87,335,1682,d2d2c3ecece59cb0,Richard Phillips Feynman was an American physicist known for his work in the physics of the atomic nucleus and particle interactions through quantum field theory. He was a professor at the California Institute of Technology (Caltech) and is widely regarded as one of the greatest physicists of the 20,OK
2026-06-09 14:38:03,v23_D2_hf,tqy-HP-Z240-WS-HALRandD,Quadro M4000,2.5.1+cu121,float16,hf_direct,1,0.1,Qwen/Qwen2.5-3B-Instruct,CR4,正多面体サスペンス,4,74.369,6.72,500,728,cb47feaf26feb5e6,"もちろん、お手伝いします。では、この短編サスペンスは「正四面体」を舞台にします。

タイトル：「四面の秘密」

ある日、建築家の山田は、彼の古い友人・佐藤から、彼が遺した謎めいた正四面体の模型を譲り受けました。正四面体は、全ての面が等しい三角形で構成される立体で、その神秘的な形状と数理的な特性から、多くの人々に興味を引く存在でした。

山田は、佐藤が亡くなった直前に、彼が正四面体について語ったことを思い出しました。佐藤は、正四面体が宇宙の秘密を秘めたものだと信じており、彼の研究は、正四面体の幾何学的特徴と、その形状が持つ神秘的な意味を追求したものでした。

山田は、正四面体の模型を手に取り、そ",OK
2026-06-09 14:38:22,v23_D2_hf,tqy-HP-Z240-WS-HALRandD,Quadro M4000,2.5.1+cu121,float16,hf_direct,1,0.1,Qwen/Qwen2.5-3B-Instruct,CR2,素数と詩,4,19.239,9.1,175,251,e50562de8e817e8f,"選んだ素数は、13です。

十三の光，夜の星，
暗闇に燃え盛る希望の火。
無限の数の一部，
静かに輝き続ける。

十三の節，人生の道，
それぞれが独自の意味を持つ。
困難も乗り越える力，
その強さは不変だ。

十三の月，月光の舞い，
夜空を彩る美しい旋律。
繰り返し続くサイクル，
しかし、新たな始まりを告げる。

十三の風，自由の翼，
心を揺さぶる勇気を与える。
未知への挑戦への呼びかけ，
その旅は永遠だ。

十三の数は、シンプルでありながら深みがある。
その神秘性と美しさは、詩の世界に溶け込む。",OK
2026-06-09 14:39:08,v23_D2_hf,tqy-HP-Z240-WS-HALRandD,Quadro M4000,2.5.1+cu121,float16,hf_direct,1,0.1,Qwen/Qwen2.5-3B-Instruct,FY,Feynman,5,45.892,7.74,355,1757,aa4843befc61e928,Richard Phillips Feynman was an American physicist known for his work in the physics of the atomic nucleus and particle interactions through quantum field theory. He was a professor at the California Institute of Technology (Caltech) and is widely regarded as one of the greatest physicists of the 20,OK
2026-06-09 14:40:19,v23_D2_hf,tqy-HP-Z240-WS-HALRandD,Quadro M4000,2.5.1+cu121,float16,hf_direct,1,0.1,Qwen/Qwen2.5-3B-Instruct,CR4,正多面体サスペンス,5,70.59,6.83,482,752,25baa3632ac6deaa,"もちろん、お手伝いします。では、この短編サスペンスは「正四面体」を舞台にします。

タイトル：「四面の秘密」

ある日、大学の物理教室で、学生のジョンは偶然、正四面体の模型を見つけました。彼は興味を持ち、その形状と性質について調べ始めました。その夜、彼はモデルの一部を手に入れて、学校の図書館で正多面体に関する本を探しました。

ジョンは、正四面体の特性を理解し、その神秘的な構造に魅了されました。しかし、その夜、彼は正四面体の一部が欠けていたことに気づきました。それは、正四面体の中心にある、最も重要な部分でした。

ジョンは、その欠片を探すため、学校の地下室へと向かいました。地下室には、古い科学",OK
2026-06-09 14:40:39,v23_D2_hf,tqy-HP-Z240-WS-HALRandD,Quadro M4000,2.5.1+cu121,float16,hf_direct,1,0.1,Qwen/Qwen2.5-3B-Instruct,CR2,素数と詩,5,20.117,9.05,182,251,116eaa0b344e942c,"選んだ素数は、13です。

十三の光，夜の守り手
暗闇に照らし、心を温める
無限の数の一部
静かに存在し、輝く

十三は孤独でもあり、
しかし、その孤独が強さを増す
それは、個性と独特の美
世界を彩る、不規則な花

この数は、偶然の産物でもあり、
しかし、その偶然には深意がある
十三は、私たちの視覚を超えた
神秘的な存在

十三は、詩の一部
そして詩は、十三の言葉
それぞれが独自の意味を持ち
組み合わさって、新たな世界を生み出す

このように、13という素数は、詩の世界でも重要な役割を果たします。",OK
2026-06-09 14:41:28,v23_D2_hf,tqy-HP-Z240-WS-HALRandD,Quadro M4000,2.5.1+cu121,float16,hf_direct,1,0.1,Qwen/Qwen2.5-3B-Instruct,FY,Feynman,6,49.082,7.6,373,1986,1c2d4d7f96d8063c,"Richard Phillips Feynman was an American physicist known for his groundbreaking work in quantum mechanics and particle physics. He was also a Nobel laureate, having received the Nobel Prize in Physics in 1965 along with Julian Schwinger and Sin-Itiro Tomonaga for developing new principles to underst",OK
2026-06-09 14:42:43,v23_D2_hf,tqy-HP-Z240-WS-HALRandD,Quadro M4000,2.5.1+cu121,float16,hf_direct,1,0.1,Qwen/Qwen2.5-3B-Instruct,CR4,正多面体サスペンス,6,74.979,6.71,503,773,b049b81c87cb700d,"もちろん、お手伝いします。では、この短編サスペンスは「正十二面体」をテーマにします。

タイトル：「十二面の秘密」

ある日、建築家のトーマスは、彼の新しいプロジェクトのために、正十二面体の模型を作成することにしました。彼はその形状が美しいと感じ、それを自分の家に取り入れることに決めました。

トーマスは、正十二面体の模型を完成させ、その美しい形を部屋の一部として飾りました。しかし、その夜、彼は不思議な現象に遭遇しました。部屋の中央に立つ正十二面体の模型が、突然動き始めました。それは、トーマスの視線を追いかけて、部屋全体を回転し始めました。

最初は驚きと恐怖から、トーマスはすぐに冷静さを取り",OK
2026-06-09 14:43:05,v23_D2_hf,tqy-HP-Z240-WS-HALRandD,Quadro M4000,2.5.1+cu121,float16,hf_direct,1,0.1,Qwen/Qwen2.5-3B-Instruct,CR2,素数と詩,6,21.512,8.97,193,252,8558c9add7441a37,"選んだ素数は、13です。

十三の光，夜の守り手
暗闇に輝き，静かに
無数の星より遠く
孤独な旅人へ

十三の心，厳しく
柔らかな心地よさとは
異なる深みと重み
それは、独自の美しさ

十三の夢，不思議な
それは、未知への挑戦
その先には何が待っているか
予測不能の冒険

十三の道，狭い
しかし、その中で
新たな視点が開ける
それは、成長への鍵

十三の歌，独特の
旋律は、聴く者を
引き込む力がある
それは、心を揺さぶる

十三の詩，神秘的な
それは、数の秘密を
告げる言葉である
それが、私の詩です",OK
2026-06-09 14:44:39,v23_D2_hf,tqy-HP-Z240-WS-HALRandD,Quadro M4000,2.5.1+cu121,float16,hf_direct,1,0.1,Qwen/Qwen2.5-3B-Instruct,FY,Feynman,7,94.686,6.34,600,2994,0f11e70193f01aac,"Richard Phillips Feynman was an American physicist known for his groundbreaking work in the path integral formulation of quantum mechanics, for his demonstrations of the principles of quantum electrodynamics, and for the development of quantum computing, superfluidity, and dynamical friction. He was",OK
2026-06-09 14:46:04,v23_D2_hf,tqy-HP-Z240-WS-HALRandD,Quadro M4000,2.5.1+cu121,float16,hf_direct,1,0.1,Qwen/Qwen2.5-3B-Instruct,CR4,正多面体サスペンス,7,84.993,6.47,550,830,0811278c8fb94cb3,"もちろん、お手伝いします。では、この短編サスペンスは「正四面体」を舞台にします。

タイトル：「四面の秘密」

ある日、建築家のリチャードは、彼の古い友人であるエドワードと再会しました。エドワードは数年ぶりに訪ねてきたリチャードの家にやってきたのです。リチャードの家は、彼が設計した唯一の建築作品で、その形状は正四面体でした。

エドワードは、リチャードが設計した正四面体の内部を探索したいと申し出ました。リチャードは、彼の友人がかつて何を考えていたのか興味深く思い、彼の提案を快諾しました。

エドワードは、正四面体の各頂点に設置された小さな穴から、小さなカメラを設置し始めました。彼は、正四面体の",OK
2026-06-09 14:46:19,v23_D2_hf,tqy-HP-Z240-WS-HALRandD,Quadro M4000,2.5.1+cu121,float16,hf_direct,1,0.1,Qwen/Qwen2.5-3B-Instruct,CR2,素数と詩,7,15.241,9.38,143,191,6c22d8c6985b7da3,"選んだ素数は、13です。

十三の光，夜の守り手
暗闇に照らし、心を温める
無限の数の一部
静かに存在し、輝く

十三の名は、孤独と
神秘に満ち溢れています
それは、偶然の産物でも
必然の結果でもありません

十三は、時系列の節目
月の満ち欠けのサイクルにも
現れます
その数は、宇宙の法則に
深く根ざしています

十三は、詩人の言葉
そして、私たちの心に
永遠に響き続けるでしょう",OK
2026-06-09 14:48:10,v23_D2_hf,tqy-HP-Z240-WS-HALRandD,Quadro M4000,2.5.1+cu121,float16,hf_direct,1,0.1,Qwen/Qwen2.5-3B-Instruct,FY,Feynman,8,110.27,6.03,665,3159,a9500dddde01e961,Richard Phillips Feynman was an American physicist known for his work in the physics of the atomic nucleus and particle interactions through quantum field theory. He was a professor at the California Institute of Technology (Caltech) and is widely regarded as one of the greatest physicists of the 20,OK
2026-06-09 14:50:05,v23_D2_hf,tqy-HP-Z240-WS-HALRandD,Quadro M4000,2.5.1+cu121,float16,hf_direct,1,0.1,Qwen/Qwen2.5-3B-Instruct,CR4,正多面体サスペンス,8,115.154,5.9,679,1020,96f00cb90ff3543a,"もちろん、お手伝いします。では、この短編サスペンスは「正四面体」を舞台にします。

タイトル：「四面の秘密」

ある日、大学の物理教室で、学生のジョンが偶然見つけた一本の古い本。そのタイトルは「正四面体の秘密」。ジョンは興味を持ち、その本を読み始めました。しかし、その内容は予想外のものでした。本の中には、正四面体の各頂点に設置された特殊な装置についての記述があり、それらは未知のエネルギー源を生成するものだと。そして、その秘密を知った人々は、正四面体の各頂点に集まり、それぞれの装置を操作しました。

最初は、装置が正常に動作し、期待通りのエネルギーが放出される様子に、人々は喜びました。しかし、次",OK
2026-06-09 14:50:23,v23_D2_hf,tqy-HP-Z240-WS-HALRandD,Quadro M4000,2.5.1+cu121,float16,hf_direct,1,0.1,Qwen/Qwen2.5-3B-Instruct,CR2,素数と詩,8,18.352,9.15,168,208,f453eeb229ee4a96,"選んだ素数は、13です。

十三の光，夜の星，
暗闇に燃え盛る希望の火。
無限の数の一部，
静かに舞い踊る神秘。

十三の名，厳しく，
世界の端から始まる数。
奇数の王様，
全ての偶数を圧倒する力。

十三の日，月の満ち欠けの間，
月の影が揺らぐ夜。
十三の夜，深淵の秘密に耳を傾け，
宇宙の謎を語りかける。

十三の歌，心の深みへと，
旅立ち、響き渡る旋律。
その音は、言葉を超えて伝わる，
十三の詩，永遠の響き。",OK
2026-06-09 14:52:02,v23_D2_hf,tqy-HP-Z240-WS-HALRandD,Quadro M4000,2.5.1+cu121,float16,hf_direct,1,0.1,Qwen/Qwen2.5-3B-Instruct,FY,Feynman,9,99.179,6.24,619,2993,d53738766e4159c1,Richard Phillips Feynman was an American physicist known for his work in the physics of the atomic nucleus and particle interactions through quantum field theory. He was a professor at the California Institute of Technology (Caltech) and is widely regarded as one of the greatest physicists of the 20,OK
2026-06-09 14:53:17,v23_D2_hf,tqy-HP-Z240-WS-HALRandD,Quadro M4000,2.5.1+cu121,float16,hf_direct,1,0.1,Qwen/Qwen2.5-3B-Instruct,CR4,正多面体サスペンス,9,74.969,6.71,503,713,fa3053bec6f4824d,"もちろん、お手伝いします。では、この短編サスペンスは「正四面体」を舞台に設定します。

タイトル：「四面の秘密」

ある日、建築家・田中は自宅の玄関から突然現れた謎の人物に出会った。彼は田中の家の正四面体形状の屋根の一部を指さし、その秘密について話しかけてきた。その人物は「正四面体」という形が持つ神秘性について語り始め、田中は興味を持ち始めた。

その夜、田中は夢の中で正四面体の屋根の一部が動くのを見た。そして、その夢が現実になったと気づいたときには、彼はすでに屋根の一部がずれていた。その隙間から、何かが見え隠れしていた。

次第に、田中はその謎の人物と接触を取ることを決意する。彼はその人物に",OK
2026-06-09 14:53:30,v23_D2_hf,tqy-HP-Z240-WS-HALRandD,Quadro M4000,2.5.1+cu121,float16,hf_direct,1,0.1,Qwen/Qwen2.5-3B-Instruct,CR2,素数と詩,9,12.437,9.65,120,156,a808f82f7e39e9af,"選んだ素数は、13です。

十三の光，夜の守り手
暗闇に照らし、心を温める
無限の数の一部，静かに
世界を包み込む神秘

この詩では、「13」を象徴的な要素として取り上げ、その神秘性や、夜の守り手としての役割を表現しています。また、暗闇を照らす光と、心を温めるという言葉も、13が持つ特別な意味を表現しています。",OK
2026-06-09 14:54:34,v23_D2_hf,tqy-HP-Z240-WS-HALRandD,Quadro M4000,2.5.1+cu121,float16,hf_direct,1,0.1,Qwen/Qwen2.5-3B-Instruct,FY,Feynman,10,64.185,7.09,455,2410,18011db299e44018,Richard Phillips Feynman was an American physicist known for his work in the physics of the atomic nucleus and particle interactions through quantum field theory. He was a professor at the California Institute of Technology (Caltech) and is widely regarded as one of the greatest physicists of the 20,OK
2026-06-09 14:56:05,v23_D2_hf,tqy-HP-Z240-WS-HALRandD,Quadro M4000,2.5.1+cu121,float16,hf_direct,1,0.1,Qwen/Qwen2.5-3B-Instruct,CR4,正多面体サスペンス,10,90.638,6.35,576,914,af2868a5adbff4fe,"もちろん、お手伝いします。では、この短編サスペンスは「正十二面体」をテーマにします。

タイトル：「十二面の秘密」

ある日、建築家のトムは、彼の友人である数学教師、エリックから、彼が設計した最新のプロジェクトについて話されました。それは、正十二面体を基盤とした巨大な建築物でした。トムは興奮しながら、そのデザインの美しさと複雑さを語っていました。

エリックは、トムの設計が彼の数学的な才能を最大限に引き出すものだと信じていました。しかし、そのプロジェクトは徐々に異様な動きを始めていました。エリックは、トムにプロジェクトの詳細を全て知らせるよう求めました。

トムは、エリックの要求に応じて、プロ",OK
2026-06-09 14:56:15,v23_D2_hf,tqy-HP-Z240-WS-HALRandD,Quadro M4000,2.5.1+cu121,float16,hf_direct,1,0.1,Qwen/Qwen2.5-3B-Instruct,CR2,素数と詩,10,10.406,9.9,103,139,d48fdefbeb1766ee,"選んだ素数は、13です。

十三の光，夜の星，
暗闇から照らす勇気，
心の深みに響く，
その音は永遠に。

十三の節，運命の道，
困難を乗り越える力，
勇気と忍耐が育む，
新たな希望への扉。

十三の数，神秘の輪，
宇宙の法則に従う，
全ての物事には，
その意味があると信じる。",OK
2026-06-09 14:56:56,v23_D2_hf,tqy-HP-Z240-WS-HALRandD,Quadro M4000,2.5.1+cu121,float16,hf_direct,1,0.1,Qwen/Qwen2.5-3B-Instruct,FY,Feynman,11,41.249,7.93,327,1590,be06411420860e82,"Richard Phillips Feynman was an American physicist known for his groundbreaking work in the path integral formulation of quantum mechanics, for his demonstrations of the principles of quantum electrodynamics, and for the development of quantum computing, superfluidity, and dynamical friction. He was",OK
2026-06-09 14:58:15,v23_D2_hf,tqy-HP-Z240-WS-HALRandD,Quadro M4000,2.5.1+cu121,float16,hf_direct,1,0.1,Qwen/Qwen2.5-3B-Instruct,CR4,正多面体サスペンス,11,78.566,6.62,520,788,efbab5dde46e6d8d,"もちろん、お手伝いします。では、この短編サスペンスは「正四面体」を舞台に設定します。

タイトル：「四面の秘密」

ある日、建築家・田中は自宅の玄関から突然現れた謎の人物に出会った。彼は田中の家の正四面体形状の屋根の一部を指さし、その秘密について話しかけてきた。その人物は「正四面体」という形が持つ神秘性について語り始める。

「正四面体は、宇宙の秩序と連携する存在だと言われています。あなたの家は、その秩序を破ろうとしているのです。」

田中は驚きつつも、その人物の言葉を信じる。そして、その夜、田中の家の屋根の一部が不意に動いた。それは正四面体の一部が、ゆっくりと回転し始めたことだった。

「正",OK
