timestamp,experiment,hostname,gpu,torch_ver,dtype,framework,batch_size,temperature,model,tc_id,tc_name,run,elapsed_sec,tok_per_sec,gen_tokens,reply_len,reply_hash,reply,status
2026-06-10 08:26:10,v23_D2_hf,tqy-HP-Z240-WS-HALRandD,Quadro M4000,2.5.1+cu121,float16,hf_direct,1,0.1,Qwen/Qwen2.5-3B-Instruct,CR4,正多面体サスペンス,369,67.271,6.93,466,701,931cc43e596f0d34,"もちろん、お手伝いします。では、この短編サスペンスは「正十二面体」をテーマにします。

タイトル：「十二面の秘密」

ある日、建築家のトーマスは、彼の新しいプロジェクトのために、正十二面体の模型を作成することを決めた。彼はその形状が美しいと信じていたからだ。しかし、彼の予想とは裏腹に、模型の完成後、彼は正十二面体の内部に奇妙な感覚を感じた。それはまるで、何かが彼を追っているかのように。

トーマスはそれを無視し、プロジェクトを進めた。しかし、彼の心は不安定になっていた。彼は夜中に目覚めることもあった。そして、彼の部屋には、正十二面体の影が映るようになっていた。

ある夜、トーマスは部屋を出ると",OK
2026-06-10 08:26:24,v23_D2_hf,tqy-HP-Z240-WS-HALRandD,Quadro M4000,2.5.1+cu121,float16,hf_direct,1,0.1,Qwen/Qwen2.5-3B-Instruct,CR2,素数と詩,369,13.646,9.53,130,186,2f74ea98ddae2172,"選んだ素数は、13です。

十三の光，夜の星，
暗闇から照らす勇気，
無限の可能性を，
心に刻む日々。

十三の節目，新たな旅立ち，
挑戦への扉を開く勇気，
困難を越えて進む，
その力強い歩み。

十三の数は神秘，
宇宙の秘密を秘めた数，
私たちの心に響き渡る，
その音色は永遠。

この詩は、13という素数の神秘性や、その数字が私たちの生活に与える影響を表現しています。",OK
2026-06-10 08:27:06,v23_D2_hf,tqy-HP-Z240-WS-HALRandD,Quadro M4000,2.5.1+cu121,float16,hf_direct,1,0.1,Qwen/Qwen2.5-3B-Instruct,FY,Feynman,370,42.405,7.88,334,1677,d3913917870eb363,Richard Phillips Feynman was an American physicist known for his work in the physics of the atomic nucleus and particle interactions through quantum field theory. He was a professor at the California Institute of Technology (Caltech) and is widely regarded as one of the greatest physicists of the 20,OK
2026-06-10 08:28:41,v23_D2_hf,tqy-HP-Z240-WS-HALRandD,Quadro M4000,2.5.1+cu121,float16,hf_direct,1,0.1,Qwen/Qwen2.5-3B-Instruct,CR4,正多面体サスペンス,370,95.138,6.26,596,888,77ed3d1a4099f7c3,"もちろん、お手伝いします。では、この短編サスペンスは「正十二面体」をテーマにします。

タイトル：「十二面の秘密」

ある日、建築家のリチャードは、彼の新しいプロジェクトのために、正十二面体の模型を作成することにしました。彼はその形状が美しいと感じ、また、その構造が他の多面体よりも強固であると信じていました。

リチャードは模型を完成させ、それを自宅の地下室に保管しました。しかし、彼はその秘密を隠すため、地下室の鍵を自分の名前と「12」で組み合わせたパスワードに変更しました。

数週間後、リチャードは突然、頭痛と吐き気を伴う不快な症状を訴えました。彼はすぐに病院に行きましたが、医師は彼の症状を",OK
2026-06-10 08:28:50,v23_D2_hf,tqy-HP-Z240-WS-HALRandD,Quadro M4000,2.5.1+cu121,float16,hf_direct,1,0.1,Qwen/Qwen2.5-3B-Instruct,CR2,素数と詩,370,9.113,10.1,92,110,549616476e767776,"選んだ素数は、13です。

十三の光，夜の守り手
暗闇に照らし、心を温める
無限の数の一部
静かに存在し、輝く

十三は孤独でもあり、
しかし、その孤独が強さを増す
詩の世界では、個々の数字も命ある
13 - 素数の歌姫",OK
2026-06-10 08:29:29,v23_D2_hf,tqy-HP-Z240-WS-HALRandD,Quadro M4000,2.5.1+cu121,float16,hf_direct,1,0.1,Qwen/Qwen2.5-3B-Instruct,FY,Feynman,371,38.121,8.05,307,1543,2591cea08d12d965,Richard Phillips Feynman was an American physicist known for his work in the physics of the atomic nucleus and particle interactions through quantum field theory. He was a professor at the California Institute of Technology (Caltech) and is widely regarded as one of the greatest physicists of the 20,OK
2026-06-10 08:30:55,v23_D2_hf,tqy-HP-Z240-WS-HALRandD,Quadro M4000,2.5.1+cu121,float16,hf_direct,1,0.1,Qwen/Qwen2.5-3B-Instruct,CR4,正多面体サスペンス,371,86.57,6.43,557,881,0534012cf8dc605b,"もちろん、お手伝いします。では、この短編サスペンスは「正十二面体」をテーマにします。

タイトル：「十二面の秘密」

ある日、建築家・田中は自宅の玄関先に、一枚の小さな紙切れを見つけました。その上には、正十二面体の図形が描かれているだけでした。田中の心は一瞬にして冷たくなりました。彼はその紙切れを手に取り、自宅の地下室へと向かいました。

地下室は、数年前に田中が新しいプロジェクトのために作られた場所でした。そこには、彼が設計した複雑な構造物の模型が並んでいました。その中に、正十二面体の模型がありました。

田中はその模型を手に取り、正十二面体の各頂点に注目しました。各頂点には、小さな穴が開い",OK
2026-06-10 08:31:07,v23_D2_hf,tqy-HP-Z240-WS-HALRandD,Quadro M4000,2.5.1+cu121,float16,hf_direct,1,0.1,Qwen/Qwen2.5-3B-Instruct,CR2,素数と詩,371,11.484,9.75,112,131,da685135eeb0ff85,"選んだ素数は、13です。

十三の光，夜の守り手
暗闇に輝き、静かに
無数の星より遥か遠く
孤独な旅人へ

十三の力，心の鍵
秘めた秘密を告げる
不思議な数に包まれた
勇気と決意の歌

十三の夢，無限の道
未知なる世界への扉
挑戦者たちが歩む
新たな旅路の始まり",OK
2026-06-10 08:31:42,v23_D2_hf,tqy-HP-Z240-WS-HALRandD,Quadro M4000,2.5.1+cu121,float16,hf_direct,1,0.1,Qwen/Qwen2.5-3B-Instruct,FY,Feynman,372,35.465,8.18,290,1455,58ff2f468277ccc8,Richard Phillips Feynman was an American physicist known for his work in the physics of the atomic nucleus and particle interactions through quantum field theory. He was awarded the Nobel Prize in Physics in 1965 along with Julian Schwinger and Sin-Itiro Tomonaga for developing new principles for de,OK
2026-06-10 08:32:52,v23_D2_hf,tqy-HP-Z240-WS-HALRandD,Quadro M4000,2.5.1+cu121,float16,hf_direct,1,0.1,Qwen/Qwen2.5-3B-Instruct,CR4,正多面体サスペンス,372,69.971,6.85,479,691,a06250607d63000d,"もちろん、お手伝いします。では、この短編サスペンスは「正十二面体」をテーマにします。

タイトル：「十二面の秘密」

ある日、建築家の山田は、友人の工場で働く青年・佐藤と偶然出会った。山田は佐藤が設計した工場の一部が、正十二面体の形状をしていることに気づいた。その形状は、工場の一部が不規則に配置されていることから見つけられたものだった。

山田は佐藤にその秘密について話すことを拒否し、彼の設計を盗んだと疑う。しかし、佐藤は正十二面体の形状が工場の機能性を向上させる理由を説明する。山田はそれを信じず、佐藤を追い詰めるように仕向ける。

ある夜、山田は工場に潜入し、正十二面体の内部を探検する。その",OK
2026-06-10 08:33:05,v23_D2_hf,tqy-HP-Z240-WS-HALRandD,Quadro M4000,2.5.1+cu121,float16,hf_direct,1,0.1,Qwen/Qwen2.5-3B-Instruct,CR2,素数と詩,372,12.553,9.64,121,158,cff0b87167c7d200,"選んだ素数は、13です。

十三の光，夜の守り手
暗闇に照らし、心を温める
無限の数の一部
静かに存在し、輝く

この詩では、13という素数を象徴的に扱っています。特に、13は多くの文化や伝統において特別な意味を持ちます。しかし、ここでは単純に「13」という数値を詩の中心に据え、その神秘性と静けさを表現しています。",OK
2026-06-10 08:34:35,v23_D2_hf,tqy-HP-Z240-WS-HALRandD,Quadro M4000,2.5.1+cu121,float16,hf_direct,1,0.1,Qwen/Qwen2.5-3B-Instruct,FY,Feynman,373,89.906,6.43,578,2896,4edd6eb4ca299a4d,Richard Phillips Feynman was an American physicist known for his work in the physics of the atomic nucleus and particle interactions through quantum field theory. He was a professor at the California Institute of Technology (Caltech) and is widely regarded as one of the greatest physicists of the 20,OK
2026-06-10 08:35:58,v23_D2_hf,tqy-HP-Z240-WS-HALRandD,Quadro M4000,2.5.1+cu121,float16,hf_direct,1,0.1,Qwen/Qwen2.5-3B-Instruct,CR4,正多面体サスペンス,373,83.699,6.5,544,847,c21b810435436a60,"もちろん、お手伝いします。では、この短編サスペンスは「正四面体」を舞台に設定します。

タイトル：「四面の秘密」

ある日、大学の物理教室で、学生のジョンは偶然、正四面体の模型を見つけました。彼は興味を持ち、その形状と性質について調べ始めました。その夜、彼はモデルを部屋に持ち込み、四面のそれぞれに異なる色を塗りました。そして、その四面の一つを選び、その面が向かっている方向に目を向けました。

次第に、彼は四面の一つが常に同じ方向を向いていることに気づきました。これは偶然なのか、それとも何か深い意味があるのか？ その疑問から、ジョンは四面体の性質を深く研究し始めました。

ある日、彼は偶然、四面",OK
2026-06-10 08:36:10,v23_D2_hf,tqy-HP-Z240-WS-HALRandD,Quadro M4000,2.5.1+cu121,float16,hf_direct,1,0.1,Qwen/Qwen2.5-3B-Instruct,CR2,素数と詩,373,12.199,9.67,118,163,d8bc0f7329889948,"選んだ素数は、13です。

十三の光，夜の守り手
暗闇に照らし、心を温める
無限の数の一部
静かに存在し、輝く

十三は孤独でもあり、
しかし、その孤独が強さを増す
それは、他の数とは異なる
特別な存在である

この詩は、13という素数の特性や意味を表現しています。孤独と強さ、特別さなど、13の象徴的な要素を取り入れました。",OK
2026-06-10 08:36:59,v23_D2_hf,tqy-HP-Z240-WS-HALRandD,Quadro M4000,2.5.1+cu121,float16,hf_direct,1,0.1,Qwen/Qwen2.5-3B-Instruct,FY,Feynman,374,48.196,7.64,368,1761,d143ec77f98fed5a,Richard Phillips Feynman was an American physicist known for his work in the physics of the atomic nucleus and particle interactions through quantum field theory. He was a professor at the California Institute of Technology (Caltech) and is widely regarded as one of the greatest physicists of the 20,OK
2026-06-10 08:38:05,v23_D2_hf,tqy-HP-Z240-WS-HALRandD,Quadro M4000,2.5.1+cu121,float16,hf_direct,1,0.1,Qwen/Qwen2.5-3B-Instruct,CR4,正多面体サスペンス,374,66.871,6.94,464,663,4a93627346862252,"もちろん、お手伝いします。では、この短編サスペンスは「正十二面体」をテーマにします。

タイトル：「十二面の秘密」

ある日、建築家・田中は自宅の玄関ホールに不思議な光景を目撃した。壁の一部が突然動いて、その中に正十二面体の模型が現れ、次第にその形状が拡大し、空間全体に広がっていく。その瞬間、田中の脳裏に、幼少期の夢幻のような記憶が蘇った。

それは、彼が幼少期に住んでいた小さな町の中心にある、神秘的な建物だった。その建物は、正十二面体の外観を模した独特の形をしており、その内部には、誰も解明できなかった謎が詰まっていた。

田中は、その正十二面体の模型に興味を持ち、その秘密を解き明かすための旅",OK
2026-06-10 08:38:31,v23_D2_hf,tqy-HP-Z240-WS-HALRandD,Quadro M4000,2.5.1+cu121,float16,hf_direct,1,0.1,Qwen/Qwen2.5-3B-Instruct,CR2,素数と詩,374,25.091,8.77,220,274,c8e6f941badbfa68,"選んだ素数は、13です。

十三の光，夜の守り手
暗闇に輝き，静かに
無数の星より遠く
孤独な旅人へ

十三の名，厳しく
風と雨，嵐と静けさ
全てを経験し
その強さを育む

十三の心，深く
時を超えて
静かに揺れ動く
その揺れは美徳

十三の夢，遥か
未来への道しるべ
未知なる世界へ
進む勇気を育む

十三の詩，短く
しかし力強く
素数の魂を
歌う

この詩は、13という素数の特性や意味を表現しています。十三は奇数であり、素数の中でも最も小さな偶数素数です。また、13はカレンダーの月の日数にも使われます。これらの特徴を詩に取り入れてみました。",OK
2026-06-10 08:40:19,v23_D2_hf,tqy-HP-Z240-WS-HALRandD,Quadro M4000,2.5.1+cu121,float16,hf_direct,1,0.1,Qwen/Qwen2.5-3B-Instruct,FY,Feynman,375,108.128,6.07,656,3120,844f05fbbb8241df,Richard Phillips Feynman was an American physicist known for his work in the physics of the atomic nucleus and particle interactions through quantum field theory. He was a professor at the California Institute of Technology (Caltech) and is widely regarded as one of the greatest physicists of the 20,OK
2026-06-10 08:41:31,v23_D2_hf,tqy-HP-Z240-WS-HALRandD,Quadro M4000,2.5.1+cu121,float16,hf_direct,1,0.1,Qwen/Qwen2.5-3B-Instruct,CR4,正多面体サスペンス,375,72.662,6.77,492,719,40ab0ee7902e7452,"もちろん、お手伝いします。では、この短編サスペンスは「正四面体」を舞台に設定します。

タイトル：「四面の秘密」

ある日、建築家の山田は、彼の古い友人・佐藤から、彼が遺した秘密の正四面体について話されました。それは、佐藤が亡くなった後、彼が遺した唯一の物だったという、神秘的な四角い形の物体でした。

山田は、その四面体の存在を信じず、最初は無視しました。しかし、ある夜、彼は四面体が突然、自分の部屋に現れ、彼の腕時計を取っていったのです。時計が消えたことで、山田はすぐに警察に連絡しました。

警察は、四面体が物理的に存在する証拠がないことから、山田の目撃談を疑いました。しかし、山田は四面体が自",OK
2026-06-10 08:41:43,v23_D2_hf,tqy-HP-Z240-WS-HALRandD,Quadro M4000,2.5.1+cu121,float16,hf_direct,1,0.1,Qwen/Qwen2.5-3B-Instruct,CR2,素数と詩,375,11.367,9.76,111,161,714b533fdd9ddb71,"選んだ素数は、13です。

十三の光，夜の守り手
暗闇に照らし、心を温める
無限の数の一部
静かに存在し、輝く

この詩は、13という素数の特性や神秘性を表現しています。特に、13は「 unlucky」という意味を持つ英語の慣用句で使われることがありますが、それよりも単純に、その数の美しさと神秘性を表現しようとしました。",OK
2026-06-10 08:42:31,v23_D2_hf,tqy-HP-Z240-WS-HALRandD,Quadro M4000,2.5.1+cu121,float16,hf_direct,1,0.1,Qwen/Qwen2.5-3B-Instruct,FY,Feynman,376,47.844,7.65,366,1906,9b35e77f211f697d,Richard Phillips Feynman was an American physicist known for his work in the physics of the atomic nucleus and particle interactions through quantum field theory. He was a professor at the California Institute of Technology (Caltech) and is widely regarded as one of the greatest physicists of the 20,OK
2026-06-10 08:44:02,v23_D2_hf,tqy-HP-Z240-WS-HALRandD,Quadro M4000,2.5.1+cu121,float16,hf_direct,1,0.1,Qwen/Qwen2.5-3B-Instruct,CR4,正多面体サスペンス,376,91.559,6.33,580,884,43d5b862a7398368,"もちろん、お手伝いします。では、この短編サスペンスは「正四面体」を舞台にします。

タイトル：「四面の秘密」

ある日、大学の物理教室で、学生のジョンは偶然、古びた正四面体を見つけました。それは、何世紀も前に作られ、その神秘的な形状が人々を魅了していたものです。ジョンは興味を持ち、四面体を触り始めるのです。

その夜、ジョンは夢の中で四面体が動き出したことを覚えていました。それは、四面体の各頂点が次々と動き出し、それぞれの面が次第に開き始めました。ジョンは目を閉じて、その夢を見返しました。そして、その夢の中で、四面体の一つの面が突然開き、そこには、未知の世界が広がっていました。

ジョンはすぐ",OK
2026-06-10 08:44:17,v23_D2_hf,tqy-HP-Z240-WS-HALRandD,Quadro M4000,2.5.1+cu121,float16,hf_direct,1,0.1,Qwen/Qwen2.5-3B-Instruct,CR2,素数と詩,376,15.113,9.4,142,207,1e547303ce8f0bec,"選んだ素数は、13です。

十三の光，夜の守り手
暗闇に照らし、心を温める
無限の数の一部
静かに存在し、輝く

十三は孤独でもあり、
しかし、その孤独が強さを増す
それは、他の数とは異なる
特別な存在である

この詩は、13という素数の特徴や、その数に対する私的な感情を表現しています。ただし、13という数字自体が完全にポジティブなイメージを持つわけではなく、様々な文化和個人的な経験によってその評価は多様です。",OK
2026-06-10 08:45:45,v23_D2_hf,tqy-HP-Z240-WS-HALRandD,Quadro M4000,2.5.1+cu121,float16,hf_direct,1,0.1,Qwen/Qwen2.5-3B-Instruct,FY,Feynman,377,87.939,6.47,569,2777,6b439d68ce32e607,Richard Phillips Feynman was an American physicist known for his work in the physics of the atomic nucleus and particle interactions through quantum field theory. He was a professor at the California Institute of Technology (Caltech) and is widely regarded as one of the greatest physicists of the 20,OK
2026-06-10 08:46:29,v23_D2_hf,tqy-HP-Z240-WS-HALRandD,Quadro M4000,2.5.1+cu121,float16,hf_direct,1,0.1,Qwen/Qwen2.5-3B-Instruct,CR4,正多面体サスペンス,377,43.868,7.73,339,471,962ca84ad498dcdb,"もちろん、お手伝いします。では、この短編サスペンスは「正四面体」を舞台に設定します。

タイトル：「四面の秘密」

ある日、建築家・田中は自宅の玄関から突然現れた謎の人物に出会った。彼は田中の家の正四面体形状の屋根を指摘し、その屋根が正四面体であることを証明するための数学的な証拠を提示した。その人物は、田中の家の屋根が正四面体であるという事実を知っていたのか？ それとも、偶然の一致だったのか？

田中はその人物の言葉を信じるか否かを迷う。しかし、その人物はすぐに去っていった。その夜、田中の家の屋根が不意に崩れ落ちた。その瞬間、田中は正四面体の屋根が崩れる理由が正四面体の性質にあることに気づいた",OK
2026-06-10 08:46:54,v23_D2_hf,tqy-HP-Z240-WS-HALRandD,Quadro M4000,2.5.1+cu121,float16,hf_direct,1,0.1,Qwen/Qwen2.5-3B-Instruct,CR2,素数と詩,377,24.503,8.82,216,261,0613b31894b8e498,"選んだ素数は、13です。

十三の光，夜の守り手
暗闇に輝き，静かに
無数の星より遥か
その存在は謎深く

十三の名，厳しく
世界の端から始まる
奇跡の数，神秘の象徴
その力は、誰もが知る由

十三の影，孤独の旅人
道の終わりを見つめ
未知への挑戦者
その勇気は、勇ましい

十三の心，深い森
秘密を秘めた木々の間
静かな言葉を語る
その声は、聴こえず

十三の夢，遠くの星
無限の可能性を
探求する旅
その希望は、永遠に

十三の詩，不思議な数
世界を彩る色彩
その美しさは、見事
十三の歌，心に響く
その旋律は、永遠に",OK
2026-06-10 08:47:46,v23_D2_hf,tqy-HP-Z240-WS-HALRandD,Quadro M4000,2.5.1+cu121,float16,hf_direct,1,0.1,Qwen/Qwen2.5-3B-Instruct,FY,Feynman,378,52.333,7.47,391,1990,3971c88ae700c84c,Richard Phillips Feynman was an American physicist known for his work in the physics of the atomic nucleus and particle interactions through quantum field theory. He was a professor at the California Institute of Technology (Caltech) and is widely regarded as one of the greatest physicists of the 20,OK
2026-06-10 08:48:52,v23_D2_hf,tqy-HP-Z240-WS-HALRandD,Quadro M4000,2.5.1+cu121,float16,hf_direct,1,0.1,Qwen/Qwen2.5-3B-Instruct,CR4,正多面体サスペンス,378,65.699,6.97,458,671,cdf490eba22ec86b,"もちろん、お手伝いします。では、この短編サスペンスは「正四面体」を舞台にします。

タイトル：「四面の秘密」

ある日、建築家の田中は、彼の古い友人・山本から、彼が遺した秘密の正四面体を譲り受けました。それは、山本が亡くなった後、彼の部屋から見つかった、何年も前に作られたものでした。正四面体は、その美しい幾何学的な形状と、神秘的な存在感から、山本には特別な意味を持っていたようです。

田中は、正四面体の内部を探検し始めました。しかし、彼の手が触れるたびに、正四面体は異様な音を立て、その内部は不思議な光を放ちました。そして、その光は徐々に田中の意識を奪っていきました。

田中は、正四面体の内部に",OK
2026-06-10 08:49:05,v23_D2_hf,tqy-HP-Z240-WS-HALRandD,Quadro M4000,2.5.1+cu121,float16,hf_direct,1,0.1,Qwen/Qwen2.5-3B-Instruct,CR2,素数と詩,378,13.529,9.54,129,172,2d34df79cdaae502,"選んだ素数は、13です。

十三の光，夜の守り手
暗闇に照らし、心を温める
無限の数の一部，静かに
世界を包み込む神秘

この詩では、「13」を象徴的な要素として取り入れました。特に、夜の守り手や無限の数の一部など、神秘的な意味合いを持たせています。また、「十三の光」という表現で、13を光や希望に変換させ、暗闇を照らす存在として捉えています。",OK
2026-06-10 08:50:01,v23_D2_hf,tqy-HP-Z240-WS-HALRandD,Quadro M4000,2.5.1+cu121,float16,hf_direct,1,0.1,Qwen/Qwen2.5-3B-Instruct,FY,Feynman,379,55.612,7.35,409,2163,0244ec72137644a0,Richard Phillips Feynman was an American physicist known for his work in the physics of the atomic nucleus and particle interactions through quantum field theory. He was a professor at the California Institute of Technology (Caltech) and is widely regarded as one of the greatest physicists of the 20,OK
2026-06-10 08:51:34,v23_D2_hf,tqy-HP-Z240-WS-HALRandD,Quadro M4000,2.5.1+cu121,float16,hf_direct,1,0.1,Qwen/Qwen2.5-3B-Instruct,CR4,正多面体サスペンス,379,93.321,6.3,588,844,2fb99be90d285541,"もちろん、お手伝いします。では、この短編サスペンスは「正十二面体」をテーマにします。

タイトル：「十二面の秘密」

ある日、建築家・田中は自宅の玄関ホールに不思議な光景を目撃した。壁の一部が無理やり取り付けられ、その形状は正十二面体に見えた。その壁には、何の意味も解読できない文字が刻まれていた。

田中はこれを怪しんで、建築家の友人である数学教授・山本に相談した。山本はすぐに正十二面体の性質を説明し、その中に隠された可能性を指摘した。しかし、田中はそれを信じず、ただただその謎に興奮していた。

ある夜、田中はまた玄関ホールに向かって行った。その時、壁の一部が動いた。それは正十二面体の一部が開",OK
2026-06-10 08:51:49,v23_D2_hf,tqy-HP-Z240-WS-HALRandD,Quadro M4000,2.5.1+cu121,float16,hf_direct,1,0.1,Qwen/Qwen2.5-3B-Instruct,CR2,素数と詩,379,14.502,9.45,137,199,9c3cdd27ee1df331,"選んだ素数は、13です。

十三の光，夜の守り手
暗闇に照らし、心を温める
無限の数の一部
静かに存在し、輝く

この詩は、13という素数の特性や神秘性を表現しています。特に、13は「 unlucky」（不幸）と関連付けられることが多いですが、その一方で、多くの文化や伝統において特別な意味を持っています。また、「十三の光」という表現は、13の光が夜を照らす様子を描き、その存在感を強調しています。",OK
2026-06-10 08:52:59,v23_D2_hf,tqy-HP-Z240-WS-HALRandD,Quadro M4000,2.5.1+cu121,float16,hf_direct,1,0.1,Qwen/Qwen2.5-3B-Instruct,FY,Feynman,380,70.269,6.92,486,2537,9f676dd095fd3947,Richard Phillips Feynman was an American physicist known for his work in the physics of the atomic nucleus and particle interactions through quantum field theory. He was a professor at the California Institute of Technology (Caltech) and is widely regarded as one of the greatest physicists of the 20,OK
